382,The Phantom Tollbooth: A Children's Play in Two Acts,Susan Nanus/Norton Juster,4.13,0573650969,9780573650963,eng,72,100,13,1/12/2011,Samuel French  Inc.
15735,Breakfast of Champions,Robert Egan/Kurt Vonnegut Jr.,4.00,0573605734,9780573605734,eng,106,17,0,4/7/2017,Samuel French  Inc.
40156,The Thief (The Queen's Thief  #1),Megan Whalen Turner,3.88,0613060326,9780613060325,eng,220,97,17,1/28/1998,San Val
3918,Divorcio a la Francesa: Le Divorce,Diane Johnson/Carlos Milla Soler/Roberto Fernandez Sastre,2.88,8420466557,9788420466552,spa,388,6,0,6/1/2003,Santillana USA Publishing Company
14768,Los diarios de Nanny,Emma McLaughlin/Nicola Kraus,3.42,8420465607,9788420465609,spa,392,33,4,1/1/2003,Santillana USA Publishing Company
43015,A Long Way Gone: Memoirs of a Boy Soldier,Ishmael Beah,4.16,0374105235,9780374105235,eng,229,147820,9547,2/13/2007,Sarah Crichton Books
29011,One Hundred Demons,Lynda Barry,4.16,1570614598,9781570614590,en-GB,224,7703,521,8/30/2005,Sasquatch Books
8677,Robbins and Cotran Review of Pathology,Edward C. Klatt/Vinay   Kumar,4.33,0721601944,9780721601946,en-US,432,55,6,11/12/2004,Saunders
6794,Cloud Atlas,David Mitchell,4.02,0340822783,9780340822784,eng,529,6985,957,2/21/2005,Sceptre
25021,How the Irish Saved Civilization,Thomas Cahill,3.81,0340637870,9780340637876,en-GB,256,91,13,3/3/2003,Sceptre
2725,Illuminations: Essays and Reflections,Walter Benjamin/Hannah Arendt/Harry Zohn/Leon Wieseltier,4.29,0805202412,9780805202410,eng,288,9254,194,1/13/1969,Schocken
9981,Der Prozess,Franz Kafka,3.98,0805232117,9780805232110,ger,0,2,0,5/5/1988,Schocken
11161,The Trial of God: (as it was held on February 25  1649  in Shamgorod),Elie Wiesel/Robert McAfee Brown/Matthew Fox,4.14,0805210539,9780805210538,eng,208,957,72,11/14/1995,Schocken
17686,Diaries  1910-1923,Franz Kafka/Max Brod/Joseph Kresh/Martin Greenberg,4.23,0805209069,9780805209068,eng,521,2090,90,1/21/2009,Schocken
17691,Franz Kafka: The Complete Stories,Franz Kafka/Nabum N. Glazer/John Updike,4.35,0805238638,9780805238631,en-US,486,59,3,1/1/1987,Schocken
17694,The Z√ºrau Aphorisms,Franz Kafka/Michael Hofmann/Geoffrey Brock/Roberto Calasso,3.75,0805212078,9780805212075,eng,160,648,57,12/26/2006,Schocken
22911,Amerika,Franz Kafka/Willa Muir/Edwin Muir/Klaus Mann/E.L. Doctorow,3.75,0805210644,9780805210644,eng,336,17981,522,7/2/1996,Schocken
32561,The Sons,Franz Kafka/Edwin Muir/Willa Muir/Eithne Wilkins/Ernst Kaiser/Mark Anderson/Arthur S. Wensinger,3.95,0805208860,9780805208863,eng,167,529,37,8/5/1989,Schocken
2,Harry Potter and the Order of the Phoenix (Harry Potter  #5),J.K. Rowling/Mary GrandPr√©,4.49,0439358078,9780439358071,eng,870,2153167,29221,9/1/2004,Scholastic
5,Harry Potter and the Prisoner of Azkaban (Harry Potter  #3),J.K. Rowling/Mary GrandPr√©,4.56,043965548X,9780439655484,eng,435,2339585,36325,5/1/2004,Scholastic
1852,The Call of the Wild,Jack London/Avi,3.86,0439227143,9780439227148,eng,172,274649,7203,1/1/2001,Scholastic
3119,Hunting the Hunter (On the Run  #6),Gordon Korman,4.21,0439651417,9780439651417,eng,151,1928,85,2/1/2006,Scholastic
5370,Amber Brown Is Green With Envy,Paula Danziger/Tony Ross,3.95,0439071712,9780439071710,en-GB,160,834,42,8/1/2004,Scholastic
9253,Blubberina (Scrambled Legs  #5),Jahnna N. Malcolm,3.29,0590428888,9780590428880,eng,135,13,0,10/1/1989,Scholastic
10089,Mary  Queen of Scots: Queen Without a Country,Kathryn Lasky,3.83,0439194040,9780439194044,eng,202,4825,148,5/1/2002,Scholastic
10546,The Long-Lost Map (Ulysses Moore #2),Pierdomenico Baccalario/Iacopo Bruno/Leah D. Janeczko,4.00,043977439X,9780439774390,eng,272,1693,76,7/1/2006,Scholastic
17206,Lady Friday (The Keys to the Kingdom  #5),Garth Nix,3.92,0439700884,9780439700887,eng,320,19436,267,3/1/2007,Scholastic
19432,Angels Don't Know Karate (The Adventures Of The Bailey School Kids  #23),Debbie Dadey/Marcia Thornton Jones/John Steven Gurney,3.80,0590849026,9780590849029,en-US,67,741,26,11/1/1996,Scholastic
20086,The Mark of the Crown (Star Wars: Jedi Apprentice  #4),Jude Watson,3.73,0590519344,9780590519342,eng,131,2319,63,10/1/1999,Scholastic
21194,The Stranger,Caroline B. Cooney,3.53,0590456806,9780590456807,eng,198,55,11,11/1/1993,Scholastic
22208,Hush! A Thai Lullaby,Minfong Ho/Holly Meade,4.03,0531071669,9780531071663,eng,32,1315,197,3/1/2000,Scholastic
23549,The Journal of Scott Pendleton Collins: A World War 2 Soldier,Walter Dean Myers,3.96,0439050138,9780439050135,eng,140,1132,181,6/1/1999,Scholastic
24037,The Deep (Dive  #2),Gordon Korman,3.78,0439507235,9780439507233,eng,148,1436,55,7/1/2003,Scholastic
24300,Poppy,Avi,3.96,0689837186,9780689837180,eng,163,6894,501,5/3/2005,Scholastic
25041,The Case of the Snowboarding Superstar (Jigsaw Jones  #29),James Preller/R.W. Alley/Jamie  Smith,3.98,0439793955,9780439793957,en-US,80,123,13,1/1/2006,Scholastic
25321,King of the Middle March,Kevin Crossley-Holland,3.82,0439266017,9780439266017,eng,432,1334,47,3/1/2006,Scholastic
25752,Blind Flight,Hilary H. Milton,3.63,0590321145,9780590321143,en-US,122,25,5,12/1/1982,Scholastic
31486,Ruby the Red Fairy (Rainbow Magic  #1),Daisy Meadows/Georgie Ripper,3.84,043973861X,9780439738613,en-US,65,4334,319,5/1/2005,Scholastic
37594,The Eternity Code (Artemis Fowl  #3),Eoin Colfer,4.04,0439573882,9780439573887,eng,309,221,13,10/1/2003,Scholastic
38633,The Secret Garden,Frances Hodgson Burnett/Graham Rust,4.13,0590240773,9780590240772,eng,298,254,24,6/1/1999,Scholastic
38709,Holes (Holes  #1),Louis Sachar,3.96,0439244196,9780439244190,eng,233,887554,17547,9/2/2000,Scholastic
4359,How Much is That Guinea Pig in the Window?,Joanne Rocklin/Meredith Johnson,4.00,0590227165,9780590227162,en-US,48,27,7,10/1/1995,Scholastic  Inc.
17580,These Happy Golden Years (Little House  #8),Laura Ingalls Wilder/Garth Williams,4.19,0590488120,9780590488129,en-US,289,311,22,1/1/1971,Scholastic  Inc.
24052,Chasing The Falconers (On The Run  #1),Gordon Korman,4.05,0439651360,9780439651363,eng,154,4598,371,4/1/2005,Scholastic  Inc.
35807,The Rescue (Guardians of Ga'Hoole  #3),Kathryn Lasky,4.07,0439405599,9780439405591,eng,198,10154,278,1/1/2004,Scholastic  Inc.
38951,The Day My Butt Went Psycho,Andy Griffiths/Miles Thompson,3.73,0439424690,9780439424691,eng,220,1853,232,4/1/2003,Scholastic  Inc.
42714,The Giggler Treatment,Roddy Doyle/Brian Ajhar,4.17,0439993857,9780439993852,en-GB,112,1425,149,7/20/2001,Scholastic  Inc.
37911,Shipwreck (Island I),Gordon Korman/Holter Graham,3.80,0439023319,9780439023313,eng,0,103,14,2/1/2007,Scholastic Audio Books
24048,The Abduction (Kidnapped  #1),Gordon Korman,3.99,043984777X,9780439847773,eng,144,3306,263,5/1/2006,Scholastic Books
24064,No More Dead Dogs,Gordon Korman,3.71,0439294843,9780439294843,eng,180,12,2,9/1/2001,Scholastic Inc
37869,Built To Last: Building America's Amazing Bridges  Dams  Tunnels  and Skyscrapers (Built to Last),George Sullivan,4.12,0439517370,9780439517379,eng,128,24,6,10/1/2005,Scholastic Nonfiction
1936,Little Women,Louisa May Alcott/Paula Danziger,4.07,0439101360,9780439101363,eng,562,462,45,1/1/2000,Scholastic Paperbacks
3685,Black Beauty,Anna Sewell,3.96,0439228905,9780439228909,eng,245,208684,3358,3/1/2003,Scholastic Paperbacks
7023,The Burning (Guardians of Ga'Hoole  #6),Kathryn Lasky/Richard Cowdrey,4.08,0439405629,9780439405621,eng,224,9175,157,11/1/2004,Scholastic Paperbacks
13028,Alice In Wonderland,Lewis Carroll/John Tenniel,4.02,0439291496,9780439291491,eng,160,143,18,9/1/2001,Scholastic Paperbacks
14056,The Littles and Their Amazing New Friend,John Lawrence Peterson,3.87,0590876120,9780590876124,eng,112,190,16,3/1/1999,Scholastic Paperbacks
18564,The Summit (Everest  #3),Gordon Korman,3.96,0439411378,9780439411370,eng,154,2584,106,10/1/2002,Scholastic Paperbacks
19043,Tabby in the Tub (Animal Ark  #29),Ben M. Baglio/Linda Chapman/Jenny Gregory,3.96,0439343909,9780439343909,eng,139,768,33,8/1/2003,Scholastic Paperbacks
19428,The Abominable Snowman Doesn't Roast Marshmallows (The Adventures of the Bailey School Kids  #50),Debbie Dadey/Marcia Thornton Jones,3.82,0439650372,9780439650373,eng,96,402,19,3/1/2005,Scholastic Paperbacks
19435,Vampires Don't Wear Polka Dots (The Adventures of the Bailey School Kids  #1),Debbie Dadey/Marcia Thornton Jones/John Steven Gurney,3.81,059043411X,9780590434119,en-US,80,6983,215,1/1/1991,Scholastic Paperbacks
19437,Phantoms Don't Drive Sports Cars (The Adventures of the Bailey School Kids  #32),Debbie Dadey/Marcia Thornton Jones/John Steven Gurney,3.76,0590189824,9780590189828,eng,80,408,18,9/1/1998,Scholastic Paperbacks
21016,The Secret City (Pyrates  #1),Chris Archer,4.11,0439368510,9780439368513,eng,184,231,17,2/1/2003,Scholastic Paperbacks
21188,Wanted!,Caroline B. Cooney,3.69,0590988492,9780590988490,en-US,230,1969,193,7/1/1997,Scholastic Paperbacks
24056,Something Fishy at Macdonald Hall (Macdonald Hall  #7),Gordon Korman,4.06,0590255223,9780590255226,eng,208,919,13,9/1/2000,Scholastic Paperbacks
24308,Have Wheels  Will Travel (The Amazing Days of Abby Hayes  #4),Anne Mazer/Monica Gesue,3.96,0439178789,9780439178785,eng,144,975,26,4/1/2001,Scholastic Paperbacks
24316,The Trouble With Violet,Anne Mazer/Bill Brown,3.89,0439872464,9780439872461,eng,112,223,36,7/1/2007,Scholastic Paperbacks
25045,The Case of the Marshmallow Monster (Jigsaw Jones  #11),James Preller/R.W. Alley,3.92,0439184738,9780439184731,en-US,80,227,17,3/1/2001,Scholastic Paperbacks
25048,The Case Of The Buried Treasure,James Preller/Jamie Smith/R.W. Alley,3.92,043930931X,9780439309318,eng,112,101,9,1/1/2002,Scholastic Paperbacks
26480,Witness,Karen Hesse,3.72,0439272009,9780439272001,eng,161,4667,703,3/1/2003,Scholastic Paperbacks
26482,The Music of Dolphins,Karen Hesse,3.82,0590897985,9780590897983,eng,181,6015,566,2/1/1998,Scholastic Paperbacks
27880,The Girl  the Dragon  and the Wild Magic (Rhianna  #1),Dave Luckett,3.86,0439411874,9780439411875,eng,119,474,31,10/1/2003,Scholastic Paperbacks
28194,Inkheart (Inkworld  #1),Cornelia Funke/Anthea Bell,3.88,0439709105,9780439709101,eng,563,324482,9360,6/1/2005,Scholastic Paperbacks
31481,Inky The Indigo Fairy (Rainbow Magic  #6),Daisy Meadows/Georgie Ripper,3.79,043974685X,9780439746854,en-US,80,2042,59,1/1/2006,Scholastic Paperbacks
31483,Sky The Blue Fairy (Rainbow Magic  #5),Daisy Meadows/Georgie Ripper,3.83,0439746841,9780439746847,en-US,80,2267,82,11/1/2005,Scholastic Paperbacks
35805,The Capture (Guardians of Ga'Hoole  #1),Kathryn Lasky,3.90,0439405572,9780439405577,eng,222,22125,1232,6/1/2003,Scholastic Paperbacks
38911,Your Best Friend's Boyfriend (Follow Your Heart  #1),J.E. Bright,3.34,0439791405,9780439791403,eng,240,49,5,1/1/2006,Scholastic Paperbacks
38970,Thorn in Her Side (The Princess School  #7),Jane B. Mason/Sarah Hines Stephens,3.88,0439798736,9780439798730,eng,144,214,8,1/1/2006,Scholastic Paperbacks
38988,Awakening (Chasing Yesterday  #1),Robin Wasserman,3.95,0439933382,9780439933384,en-US,207,2569,297,5/1/2007,Scholastic Paperbacks
43035,White Fang,Jack London,3.98,0439236193,9780439236195,eng,252,119589,3124,1/1/2001,Scholastic Paperbacks
7609,Nacho and Lolita,Pam Mu√±oz Ryan/Claudia Rueda,3.97,0439269687,9780439269681,eng,40,34,5,10/1/2005,Scholastic Press
24431,Trickster's Choice (Daughter of the Lioness  #1),Tamora Pierce,4.27,0439968089,9780439968089,eng,453,43090,800,9/17/2004,Scholastic Press
34687,Koko's Kitten,Francine Patterson/Ronald H. Cohn,4.30,0590444255,9780590444255,eng,32,963,92,6/1/1987,Scholastic Press
45292,Walt Whitman: Words for America,Barbara Kerley/Brian Selznick,4.05,0439357918,9780439357913,eng,56,258,58,10/1/2004,Scholastic Press
44921,Explode the Code 1,Nancy Hall,4.37,0838814603,9780838814604,eng,99,89,10,1/1/2001,School Specialty Publishing
24686,Toys Go Out: Being the Adventures of a Knowledgeable Stingray  a Toughy Little Buffalo  and Someone Called Plastic (Toys #1),Emily Jenkins/Paul O. Zelinsky,3.94,0375836047,9780375836046,eng,116,3983,513,9/12/2006,Schwartz & Wade Books
34535,Rincewind the Wizzard,Terry Pratchett,4.21,0739403451,9780739403457,en-US,649,1585,24,1/1/1999,Science Fiction Book Club
165,Untouchables: My Family's Triumphant Journey Out of the Caste System in Modern India,Narendra Jadhav,3.82,0743270797,9780743270793,en-US,320,308,40,9/27/2005,Scribner
599,Sex  Drugs  and Cocoa Puffs: A Low Culture Manifesto,Chuck Klosterman,3.73,0743236017,9780743236010,eng,272,62089,3324,7/2/2004,Scribner
1627,Brokeback Mountain,Annie Proulx,3.94,0743271327,9780743271325,eng,55,24985,1751,12/2/2005,Scribner
2226,On Death and Dying,Elisabeth K√ºbler-Ross,4.16,0684842238,9780684842233,eng,288,144,10,7/2/1997,Scribner
2296,Emergence: The Connected Lives of Ants  Brains  Cities  and Software,Steven Johnson,3.96,0684868768,9780684868769,en-US,288,2769,200,9/10/2002,Scribner
3833,The Black Tower (Adam Dalgliesh #5),P.D. James,4.00,0743219619,9780743219617,eng,352,13801,335,10/2/2001,Scribner
4625,The Complete Short Stories of Ernest Hemingway,Ernest Hemingway/John Hemingway/Patrick Hemingway/Gregory H. Hemingway/Charles Scribner Jr.,4.29,0684843323,9780684843322,eng,650,30081,649,8/3/1998,Scribner
4633,Islands in the Stream,Ernest Hemingway,3.88,0743253426,9780743253420,eng,448,11265,471,7/22/2003,Scribner
4664,A Life in Letters,F. Scott Fitzgerald/Matthew J. Bruccoli,4.22,0684801531,9780684801537,eng,528,186,13,5/3/1995,Scribner
5148,A Separate Peace,John Knowles/David Levithan,3.57,0743253973,9780743253970,eng,208,175779,6261,9/30/2003,Scribner
5261,A Backward Glance,Edith Wharton/Louis Auchincloss,3.76,0684847558,9780684847559,eng,385,521,77,7/15/1998,Scribner
6150,Cry  the Beloved Country,Alan Paton,3.90,074326195X,9780743261951,eng,316,54558,2937,11/25/2003,Scribner
6857,Three Plums In One (Stephanie Plum  #1-3),Janet Evanovich,4.31,0743216393,9780743216395,eng,1016,2983,168,4/26/2001,Scribner
10566,Lisey's Story,Stephen King,3.68,0743289412,9780743289412,eng,513,59097,2709,10/24/2006,Scribner
10785,By-Line: Selected Articles and Dispatches of Four Decades,Ernest Hemingway/William M. White,3.96,0684839059,9780684839059,en-US,512,421,33,5/12/1998,Scribner
11767,The Body Artist,Don DeLillo,3.24,0743203968,9780743203968,eng,128,7201,500,2/5/2002,Scribner
12419,A Calendar of Wisdom: Daily Thoughts to Nourish the Soul,Leo Tolstoy/Peter Sekirin,4.07,0684837935,9780684837932,eng,384,502,43,10/14/1997,Scribner
12448,Look Homeward  Angel,Thomas Wolfe,3.93,0743297318,9780743297318,eng,644,11131,751,10/10/2006,Scribner
12994,Hamlet's Dresser: A Memoir,Bob      Smith,3.74,0684852705,9780684852706,eng,288,375,63,2/1/2003,Scribner
17671,Liars and Saints,Maile Meloy,3.60,0743261984,9780743261982,eng,272,2270,306,7/13/2004,Scribner
17688,The Metamorphosis  In the Penal Colony  and Other Stories: The Great Short Works of Franz Kafka,Franz Kafka,4.04,0684800705,9780684800707,eng,352,13846,193,5/22/2000,Scribner
20668,The Trouble with Testosterone and Other Essays on the Biology of the Human Predicament,Robert M. Sapolsky,4.11,0684838915,9780684838915,eng,288,1106,85,4/24/1998,Scribner
22076,From a Buick 8,Stephen King,3.45,0743211375,9780743211376,eng,356,53587,1330,9/24/2002,Scribner
24476,Fargo Rock City: A Heavy Metal Odyssey in Rural North Dakota,Chuck Klosterman,3.80,0743406567,9780743406567,eng,288,12448,526,5/1/2002,Scribner
25719,New Jewish Wedding  Revised,Anita Diamant,3.96,0743202554,9780743202558,eng,288,694,64,3/6/2001,Scribner
27999,Close Range,Annie Proulx,3.99,0684852225,9780684852225,eng,285,12555,799,2/10/2000,Scribner
28003,Heart Songs and Other Stories,Annie Proulx,3.94,0020360754,9780020360759,eng,203,1871,127,3/17/1995,Scribner
28440,A Frolic of His Own,William Gaddis,3.85,0684800527,9780684800523,eng,512,1312,106,2/10/1995,Scribner
28700,Falling Man,Don DeLillo,3.21,1416546022,9781416546023,eng,246,10304,1092,5/15/2007,Scribner
30673,Darkness at Noon,Arthur Koestler/Daphne Hardy,4.04,1416540261,9781416540267,eng,273,1307,161,10/17/2006,Scribner
32289,A Primate's Memoir: A Neuroscientist's Unconventional Life Among the Baboons,Robert M. Sapolsky,4.35,0743202414,9780743202411,eng,304,5040,590,3/12/2002,Scribner
32899,The Promise of Rest,Reynolds Price/Mary Bess Engel,4.00,0684825104,9780684825106,eng,368,253,16,11/5/1996,Scribner
33938,The Wheel of Life: A Memoir of Living and Dying,Elisabeth K√ºbler-Ross,4.16,0684846314,9780684846316,eng,288,1080,112,6/19/1998,Scribner
33973,No More Bull!: The Mad Cowboy Targets America's Worst Enemy: Our Diet,Howard F. Lyman/Glen Merzer/Joanna Samorow-Merzer/Caldwell B. Esselstyn Jr.,3.93,0743286987,9780743286985,eng,288,256,28,9/20/2005,Scribner
37390,The Pat Hobby Stories,F. Scott Fitzgerald/Arnold Gingrich,3.56,0684804425,9780684804422,eng,192,927,100,12/6/1995,Scribner
41486,Santa Cruise: A Holiday Mystery at Sea,Mary Higgins Clark/Carol Higgins Clark,3.41,1416535527,9781416535522,eng,261,4844,433,11/14/2006,Scribner
43691,The Master,Colm T√≥ib√≠n,3.83,0743250419,9780743250412,eng,339,7299,771,5/3/2005,Scribner
43702,The Blackwater Lightship,Colm T√≥ib√≠n,3.87,0743203313,9780743203319,eng,288,4421,367,6/5/2005,Scribner
18722,Alentejo Blue,Monica Ali,2.72,0743293037,9780743293037,eng,304,788,104,6/20/2006,Scribner Book Company
18990,The Honourable Schoolboy,John le Carr√©,3.95,0743457919,9780743457910,eng,589,11733,513,10/29/2002,Scribner Book Company
22312,Shampoo Planet,Douglas Coupland,3.50,0743231538,9780743231534,eng,282,8283,202,3/1/2008,Scribner Book Company
32574,The Metamorphosis And Other Stories,Franz Kafka/Joachim Neugroschel,4.03,0684194260,9780684194264,eng,227,61,6,12/1/1993,Scribner Book Company
37670,The Sun Also Rises,Ernest Hemingway,3.82,0684182602,9780684182605,eng,247,62,9,10/1/1984,Scribner Book Company
43992,True Evil,Greg Iles,4.09,0743292499,9780743292498,eng,512,13021,781,12/12/2006,Scribner Book Company
4641,The Short Stories,Ernest Hemingway,4.26,0684837862,9780684837864,en-US,464,219,21,7/25/2002,Scribner Classics
37420,The Short Stories of Ernest Hemingway,Ernest Hemingway,4.26,0020518609,9780020518600,eng,499,113,12,3/1/1987,Scribner Classics
10990,Lord John and the Private Matter (Lord John Grey  #1),Diana Gabaldon,3.70,0770429459,9780770429454,eng,368,32446,1345,10/4/2005,Seal
31114,Homelands: Women‚Äôs Journeys Across Race  Place  and Time,Patricia Justine Tumang/Edwidge Danticat/Jenesha de Rivera,4.43,158005188X,9781580051880,eng,343,42,5,12/21/2006,Seal Press
42719,The Van,Roddy Doyle,3.94,043620052X,9780436200526,eng,312,30,4,8/4/1991,Secker and Warburg
1667,El t√∫nel,Ernesto Sabato,4.05,8432216429,9788432216428,spa,159,453,60,7/1/2003,Seix Barral
35313,La Ley del Exito,Paramahansa Yogananda,4.44,0876121512,9780876121511,spa,32,0,0,6/1/1998,Self-Realization Fellowship Publishers
23946,Burroughs Live: The Collected Interviews  1960-1997,William S. Burroughs/Sylv√®re Lotringer,4.36,1584350105,9781584350101,eng,675,124,5,12/7/2001,Semiotext(e)
25895,Cleansing the Doors of Perception: The Religious Significance of Entheogenic Plants and Chemicals,Huston Smith,4.01,1591810086,9781591810087,eng,173,194,11,9/12/2003,Sentient Publications
35825,The Blonde on the Street Corner,David Goodis,3.71,1852424478,9781852424473,en-US,155,284,26,1/15/1998,Serpent's Tail
35827,The Moon in the Gutter,David Goodis/Adrian Wootton,3.65,1852424494,9781852424497,en-US,183,350,40,12/8/1998,Serpent's Tail
30836,Restless Till We Rest in You: 60 Reflections from the Writings of St. Augustine (Saints Speak Today),Augustine of Hippo,4.67,1569550344,9781569550342,eng,158,6,1,12/31/1998,Servant Publications
23955,Trainspotting,Irvine Welsh/Eric Lindor Fall,4.09,2020336464,9782020336468,fre,344,59077,857,3/6/1998,Seuil
12615,Media Control: The Spectacular Achievements of Propaganda,Noam Chomsky,4.02,1583225366,9781583225363,eng,103,4332,320,9/3/2002,Seven Stories Press
38341,The Umbrella of US Power: The Universal Declaration of Human Rights & the Contradictions of US Policy,Noam Chomsky/Greg Ruggiero,3.96,1583225471,9781583225479,en-US,80,155,7,7/9/2002,Seven Stories Press
15437,Being a Green Mother (Incarnations of Immortality  #5),Piers Anthony,3.96,0727840010,9780727840011,eng,400,41,1,10/26/1989,Severn House
3848,Desert Heat (Joanna Brady  #1),J.A. Jance,4.00,0727861158,9780727861153,eng,256,41,11,9/1/2004,Severn House Publishers
7240,The Prodigal Son (Roger the Chapman  #15),Kate Sedley,4.07,0727891626,9780727891624,en-GB,252,102,10,2/1/2007,Severn House Publishers
16918,Touchy and Feely (Sissy Sawyer  #1),Graham Masterton,3.37,072789160X,9780727891600,eng,208,86,12,2/1/2007,Severn House Publishers
16920,Hidden World,Graham Masterton,3.47,0727859625,9780727859624,eng,182,58,5,3/1/2003,Severn House Publishers
20316,Bullet Proof (Eliot Ness  #3),Max Allan Collins,3.98,0727862987,9780727862983,eng,197,31,2,12/20/2005,Severn House Publishers
35134,Nor Crystal Tears (Humanx Commonwealth  #9),Alan Dean Foster,4.03,0727845640,9780727845641,eng,231,2278,29,2/1/1994,Severn House Publishers
43799,Exit to Eden,Anne Rampling/Anne Rice,3.58,0727853414,9780727853417,eng,336,12646,323,4/24/1998,Severn House Publishers
63,The Changeling,Kate Horsley,3.55,1590301943,9781590301944,eng,339,301,43,4/12/2005,Shambhala
10238,The Tao of Physics: An Exploration of the Parallels between Modern Physics and Eastern Mysticism,Fritjof Capra,3.97,1570625190,9781570625190,eng,366,14183,398,1/4/2000,Shambhala
10534,The Art of War,Sun Tzu/Thomas Cleary/Pulat Otkan/Giray Fidan,3.97,1590302257,9781590302255,eng,273,235924,5869,1/11/2005,Shambhala
13649,Lao Tzu: Tao Te Ching: A Book about the Way and the Power of the Way,Lao Tzu/Ursula K. Le Guin/J.P. Seaton,4.30,1570623953,9781570623950,eng,125,800,91,10/20/1998,Shambhala
25789,The Book of Five Rings,Miyamoto Musashi/Thomas Cleary,4.07,1590302486,9781590302484,eng,166,926,74,1/11/2005,Shambhala
30705,Making a Change for Good: A Guide to Compassionate Self-Discipline,Cheri Huber,3.93,1590302087,9781590302088,eng,128,304,36,3/13/2007,Shambhala
41468,Dewdrops on a Lotus Leaf: Zen Poems of Ryokan,Ry≈?kan/John   Stevens,4.58,1590301080,9781590301081,eng,120,183,19,4/13/2004,Shambhala
44905,Writing Down the Bones: Freeing the Writer Within,Natalie Goldberg,4.19,1590303164,9781590303160,eng,312,21673,1395,1/10/2006,Shambhala Publications
2817,A Full House: An Austin Family Christmas (Austin Family  #5.6),Madeleine L'Engle/Mary Chambers,3.98,0877880204,9780877880202,eng,48,235,4,3/7/2000,Shaw
2814,The Rock That Is Higher: Story as Truth,Madeleine L'Engle,4.12,0877887268,9780877887263,eng,320,496,48,3/19/2002,Shaw Books
32872,Sliver of Truth (Ridley Jones #2),Lisa Unger,3.68,0307338460,9780307338464,eng,308,3015,347,1/2/2007,Shaye Areheart Books
32737,Tevye's Daughters: Collected Stories of Sholom Aleichem,Sholom Aleichem/Frances Butwin,4.17,1929068034,9781929068036,eng,302,146,13,11/1/1999,Sholom Aleichem Family Publications
2886,Death Note  Vol. 4: Ê?ãÂøÉ (Death Note  #4),Tsugumi Ohba/Takeshi Obata,4.39,4088736710,9784088736716,jpn,204,452,13,11/11/2004,Shueisha
2906,Bleach‚Äï„Éñ„É™„Éº„É?‚Äï 1 [Burƒ´chi 1] (Bleach  #1),Tite Kubo,4.22,4088732138,9784088732138,jpn,189,41,3,1/5/2002,Shueisha
43283,Unspeakable Truths and Happy Endings: Human Cruelty and the New Trauma Therapy,Rebecca Coffey,4.25,1886968055,9781886968059,en-US,226,12,0,4/1/2005,Sidran Press
669,Capitalism: The Unknown Ideal,Ayn Rand/Nathaniel Branden/Alan Greenspan/Robert Hessen,3.88,0451147952,9780451147950,eng,340,3501,153,7/15/1986,Signet
1586,Lysistrata,Aristophanes/Douglass Parker,3.85,0451616227,9780451616227,eng,98,19,2,2/1/1970,Signet
3003,The Secret Garden,Frances Hodgson Burnett/Sandra M. Gilbert,4.13,0451528832,9780451528834,eng,281,1739,116,7/1/2003,Signet
3088,A Room with a View / Howards End,E.M. Forster/Benjamin DeMott,4.10,0451521412,9780451521415,eng,449,2450,113,2/4/1986,Signet
4693,Matters of Choice (Cole Family Trilogy  #3),Noah Gordon/Mirjana Cvekiƒá/Ljiljana Cvekiƒá,3.39,0451187261,9780451187260,eng,448,2680,142,5/1/1997,Signet
5094,The Drawing of the Three (The Dark Tower  #2),Stephen King,4.23,0451210859,9780451210852,eng,463,173022,5139,8/5/2003,Signet
7138,Crime and Punishment,Fyodor Dostoyevsky/Leonard Stanton/James D. Hardy Jr./Sidney Monas/Robin Feuer Miller,4.21,0451530063,9780451530066,en-US,560,2041,183,3/7/2006,Signet
7707,Pygmalion & My Fair Lady,George Bernard Shaw/Alan Jay Lerner,4.26,0451530098,9780451530097,eng,240,14962,61,3/7/2006,Signet
8921,The Hound of the Baskervilles,Arthur Conan Doyle/Anne Perry/Sidney Paget,4.11,0451528018,9780451528018,eng,256,191128,4802,7/1/2001,Signet
9014,The Long Walk,Richard Bachman/Stephen King,4.11,0451196716,9780451196712,eng,370,94303,4453,4/1/1999,Signet
9489,Devil's Embrace (Devil  #1),Catherine Coulter,3.80,0451200268,9780451200266,eng,397,3381,116,5/1/2000,Signet
10624,Four Past Midnight: Featuring "The Langoliers",Stephen King,3.93,0451185978,9780451185976,eng,761,308,20,5/1/1995,Signet
11226,One Flew over the Cuckoo's Nest,Ken Kesey,4.20,0451143426,9780451143426,eng,272,67,5,2/1/1963,Signet
15654,The Stranger Beside Me: Ted Bundy: The Shocking Inside Story,Ann Rule,4.14,0451203267,9780451203267,eng,548,54029,2779,6/1/2001,Signet
17319,The Oath (Dismas Hardy  #8),John Lescroart,4.02,0451207645,9780451207647,eng,468,2781,133,1/7/2003,Signet
17944,The Gunslinger (The Dark Tower #1),Stephen King,3.96,0451160525,9780451160522,eng,315,1902,227,7/1/1989,Signet
23784,The Major Plays,Anton Chekhov/Ann Dunnigan/Rosamund Bartlett/Robert Brustein,4.18,0451530373,9780451530370,eng,406,102,16,12/5/2006,Signet
25171,The Old Wine Shades (Richard Jury  #20),Martha Grimes,3.60,0451220722,9780451220721,eng,391,2628,273,3/6/2007,Signet
27624,Howards End,E.M. Forster/Benjamin DeMott/Regina Marler,3.96,0451530462,9780451530462,eng,312,104,13,11/6/2007,Signet
29205,A Certain Justice (Abe Glitsky  #1),John Lescroart,4.01,0451217764,9780451217769,eng,624,2993,107,2/7/2006,Signet
30162,Jade Star (Star  #4),Catherine Coulter,3.83,0451206126,9780451206121,en-US,400,896,19,6/1/2002,Signet
