45625,A Viagem do Caminheiro da Alvorada (As Cr√≥nicas de N√°rnia  #5),C.S. Lewis/Pauline Baynes/Ana Falc√£o Bastos,4.09,9722331329,9789722331326,por,176,161,14,9/1/2004,Editorial Presen√ßa
38667,Pedro P√°ramo,Juan Rulfo,4.05,9685208557,9789685208550,spa,132,1386,209,12/1/2009,Editorial RM
18294,Critique of Pure Reason (Studies in the History of Philosophy),Immanuel Kant/Humphrey Palmer,3.94,0773491678,9780773491670,eng,140,17,0,1/1/1992,Edwin Mellen Press
1976,Den of Thieves (Cat Royal  #3),Julia Golding,4.21,1405228180,9781405228183,eng,416,1432,61,1/31/2007,Egmont Books Ltd
8023,Mr. Happy,Roger Hargreaves,3.98,1405211997,9781405211994,eng,36,1,0,4/30/2004,Egmont Children's Books
37807,Caesar's Commentaries: On the Gallic War & On the Civil War,Gaius Julius Caesar/James H. Ford/W.A. McDevitte,4.12,0976072610,9780976072614,eng,340,424,31,10/1/2005,El Paso Norte Press
12847,The Art of Dreaming,Carlos Casta√±eda,4.10,1855384272,9781855384279,eng,260,3618,97,2/16/2004,Element
3852,Primal Heat (Includes: Breeds  #8.5; Devlin Dynasty  #1; Moon Lust  #1),Lora Leigh/Sherri L. King/Lorie O'Clare/Jaci Burton,4.13,1843607409,9781843607403,eng,196,3567,62,5/15/2004,Ellora's Cave
42438,Harm's Way,Elizabeth Stewart,3.36,1419950584,9781419950582,eng,261,13,5,5/27/2005,Ellora's Cave
3636,The Giver (The Giver  #1),Lois Lowry,4.13,0385732554,9780385732550,eng,208,1585589,56604,1/24/2006,Ember
5452,Girls in Pants: The Third Summer of the Sisterhood (Sisterhood  #3),Ann Brashares,3.83,0553375938,9780553375930,eng,338,61435,1290,6/13/2006,Ember
10431,Cuba 15,Nancy Osa,3.45,0385732333,9780385732338,eng,304,1054,145,3/8/2005,Ember
23232,The Realm of Possibility,David Levithan,3.93,0375836578,9780375836572,eng,210,14625,1190,5/9/2006,Ember
15876,Harry Potter y la Orden del F√©nix (Harry Potter  #5),J.K. Rowling,4.49,8478888845,9788478888849,spa,893,5637,458,2/21/2004,Emece Editores
17950,Obra Po√©tica,Jorge Luis Borges,4.49,9500426161,9789500426169,spa,645,50,3,6/1/2005,Emec√© Editores
8489,Muhammad: A Prophet for Our Time,Karen Armstrong,4.08,0060598972,9780060598976,eng,256,1896,202,10/17/2006,Eminent Lives
23303,Ulysses S. Grant: The Unlikely Hero,Michael Korda,3.87,0060590157,9780060590154,eng,176,432,44,9/28/2004,Eminent Lives
3040,Black Rednecks and White Liberals,Thomas Sowell,4.38,1594030863,9781594030864,eng,372,2579,301,6/1/2005,Encounter Books
3770,Book of Haikus,Jack Kerouac,3.91,1904634001,9781904634003,eng,200,25,5,3/2/2004,Enitharmon Press
13345,Sabriel (Abhorsen  #1),Garth Nix,4.17,0060575816,9780060575816,en-US,311,1312,162,8/17/2004,Eos
15460,The Color of Her Panties (Xanth #15),Piers Anthony,3.67,0380759497,9780380759491,eng,342,7374,64,9/1/1992,Eos
27692,The Wicked Day (Arthurian Saga  #4),Mary  Stewart,4.09,0060548282,9780060548285,eng,417,10055,244,5/1/2003,Eos
40158,The Queen of Attolia (The Queen's Thief  #2),Megan Whalen Turner,4.19,0060841826,9780060841829,eng,362,31060,2786,1/24/2006,Eos
29533,Satan Burger,Carlton Mellick III,3.56,0971357234,9780971357235,eng,230,1691,129,11/1/2001,Eraserhead Press
12482,Amazing Disgrace (Gerald Samper #2),James Hamilton-Paterson,3.80,1933372192,9781933372198,eng,320,221,34,11/1/2006,Europa Editions
37060,Old Filth (Old Filth  #1),Jane Gardam,3.93,1933372133,9781933372136,eng,290,10337,1619,6/1/2006,Europa Editions
32830,20 000 Leagues Under The Sea,Pauline Francis/Jules Verne,3.76,0237526883,9780237526887,eng,48,563,32,8/1/2004,Evans Brothers
1796,The Iliad,Homer/Robert Fitzgerald,3.86,1857150600,9781857150605,eng,594,30,2,3/19/1992,Everyman
7600,One Hundred Years Of Solitude,Gabriel Garc√≠a M√°rquez,4.07,1857152239,9781857152234,eng,416,376,53,9/21/1995,Everyman
18073,Jeeves in the Offing (Jeeves  #12),P.G. Wodehouse,4.17,1841591165,9781841591162,eng,208,28,4,9/12/2002,Everyman
18089,The Mating Season (Jeeves  #9),P.G. Wodehouse,4.26,1841591076,9781841591070,eng,272,59,2,9/20/2001,Everyman
19282,The Odyssey,Homer/Robert Fitzgerald/Seamus Heaney,3.76,1857150945,9781857150940,eng,509,48,3,10/8/1992,Everyman
34052,Collected Stories,Rudyard Kipling,4.06,1857151992,9781857151992,eng,911,13,3,10/20/1994,Everyman
13674,The Life and Games of Mikhail Tal,Mikhail Tal/Iakov Damsky/Kenneth P. Neat,4.52,1857442024,9781857442021,eng,496,442,24,7/1/1997,Everyman Chess
19406,The Decline and Fall of the Roman Empire,Edward Gibbon,3.98,1857151925,9781857151923,eng,1952,19,1,10/1/1994,Everyman Chess
5661,Holiday Romance and Other Writings for Children,Charles Dickens,3.32,0460876015,9780460876018,eng,368,8,3,5/1/1995,Everyman Paperback Classics
1960,A Tale of Two Cities,Charles Dickens/Simon Schama,3.84,1857151437,9781857151435,eng,432,39,9,3/18/1993,Everyman's Library
5488,The Cairo Trilogy: Palace Walk / Palace of Desire / Sugar Street (The Cairo Trilogy #1-3),Naguib Mahfouz,4.46,0375413316,9780375413315,eng,1313,3347,245,10/16/2001,Everyman's Library
6656,The Divine Comedy,Dante Alighieri/Allen Mandelbaum/Eugenio Montale,4.07,0679433139,9780679433132,eng,798,86527,2004,8/1/1995,Everyman's Library
8499,The Second Sex,Simone de Beauvoir/H.M. Parshley/Margaret Crosland,4.12,1857151372,9781857151374,eng,848,47,6,3/18/1993,Everyman's Library
9330,The House of the Spirits,Isabel Allende/Madga Bogin/Christopher Hitchens,4.23,1400043182,9781400043187,eng,488,270,49,4/19/2005,Everyman's Library
9653,If on a Winter's Night a Traveler,Italo Calvino/William Weaver/Peter Washington,4.05,0679420258,9780679420255,eng,254,1444,180,6/1/1993,Everyman's Library
11729,The Bookshop  The Gate of Angels  The Blue Flower,Penelope Fitzgerald/Frank Kermode,4.07,1400041260,9781400041268,en-US,472,32,7,9/23/2003,Everyman's Library
13342,The Odes and Selected Fragments,Pindar/G.S. Conway/Richard Stoneman,3.89,0460876740,9780460876742,eng,352,7,1,3/1/1998,Everyman's Library
14279,Carried Away: A Personal Selection of Stories,Alice Munro/Margaret Atwood,4.15,0307264866,9780307264862,eng,608,620,83,9/26/2006,Everyman's Library
18062,The Best of Wodehouse: An Anthology,P.G. Wodehouse/John Mortimer,4.41,0307266613,9780307266613,eng,840,413,46,6/19/2007,Everyman's Library
30593,Pnin,Vladimir Nabokov/David Lodge,3.90,1400041988,9781400041985,eng,143,13925,848,4/6/2004,Everyman's Library
30713,Ficciones,Jorge Luis Borges/John Sturrock/Anthony Kerringan,4.45,0679422994,9780679422990,eng,192,424,54,5/25/1993,Everyman's Library
30734,The Complete Works,Michel de Montaigne/Donald M. Frame,4.44,1400040213,9781400040216,eng,1392,166,13,4/29/2003,Everyman's Library
32581,Lolita,Vladimir Nabokov/Martin Amis,3.89,0679410430,9780679410430,eng,335,1965,295,3/9/1993,Everyman's Library
32778,The Aeneid,Virgil/Robert Fitzgerald,3.84,0679413359,9780679413356,eng,483,184,21,6/30/1992,Everyman's Library
34002,The Origin of Species/The Voyage of the Beagle,Charles Darwin/Richard Dawkins,4.15,1400041279,9781400041275,eng,1024,513,34,10/14/2003,Everyman's Library
34444,Doctor Faustus,Thomas Mann/T.J. Reed/H.T. Lowe-Porter,4.08,0679409963,9780679409960,eng,580,88,14,6/2/1992,Everyman's Library
45213,The Woman In White,Wilkie Collins,4.00,185715018X,9781857150186,en-GB,664,50,11,9/26/1991,Everyman's Library
1368,The Histories,Herodotus/Edward Henry Blakeney/George Rawlinson/Rosalind Thomas,3.99,0375400613,9780375400612,en-US,816,132,10,3/25/1997,Everyman's Library 234
9121,The Portrait of Dorian Gray,Oscar Wilde/Elizabeth  Gray,4.08,1842161903,9781842161906,eng,51,85,2,10/10/1999,Express Publishing
36154,The Price of Glory (Saga of the Gray Death Legion  #3),William H. Keith Jr.,3.89,1555600387,9781555600389,eng,321,445,6,10/1/1987,FASA Corp.
19888,The Blood Wood (Earthdawn 6113),FASA Corporation/Ian Lemke/Louis J. Prosperi,3.71,1555603130,9781555603137,eng,152,31,1,6/1/1997,FASA Corporation
37063,The Gospel of Filth: A Bible of Decadence & Darkness,Gavin Baddeley/Dani Filth,4.45,9781903254,9781903254387,eng,544,114,6,2/5/2010,Fab Press
8742,The Last Temptation,Nikos Kazantzakis/Peter A. Bien,4.16,0571178561,9780571178568,eng,589,114,14,11/10/1995,Faber  Faber
14430,The Pyramid,William Golding,3.33,0571192521,9780571192526,eng,217,527,20,7/22/1997,Faber  Faber
25034,The Complete Herbal Handbook for the Dog and Cat,Juliette De Bairacli Levy,4.31,0571161154,9780571161157,eng,368,106,7,4/8/1991,Faber  Faber
28418,Taxi Driver,Paul Schrader,4.12,0571203159,9780571203154,eng,116,1030,24,2/21/2000,Faber  Faber
29881,Famous Last Words,Timothy Findley,3.99,057120905X,9780571209057,eng,416,1400,57,8/20/2001,Faber  Faber
11013,Finnegans Wake,James Joyce,3.67,0571217354,9780571217359,eng,628,9780,591,11/4/2002,Faber & Faber
19633,Self-Help,Lorrie Moore,4.20,0571145345,9780571145348,eng,176,78,9,1/10/1998,Faber & Faber
28923,When We Were Orphans,Kazuo Ishiguro,3.49,0571225403,9780571225408,eng,320,19252,1673,12/1/2007,Faber & Faber
31421,Letters Home,Sylvia Plath,4.20,0571201156,9780571201150,eng,502,2373,63,1/1/1999,Faber & Faber
35987,The Greek Islands,Lawrence Durrell,3.89,0571214266,9780571214266,eng,332,25,3,4/8/2002,Faber & Faber
38150,Orlando: A Biography: Film Screenplay,Sally Potter/Virginia Woolf,4.07,0571172954,9780571172955,eng,75,84,7,10/25/2013,Faber & Faber
44891,The Kid Stays in the Picture,Robert  Evans,3.92,0571219314,9780571219315,eng,462,2209,176,2/19/2004,Faber & Faber
17654,The Moth Diaries,Rachel Klein,3.49,0571219713,9780571219711,eng,245,60,12,4/7/2004,Faber & Faber Limited
7246,The Poisonwood Bible,Barbara Kingsolver,4.06,057120175X,9780571201754,eng,616,1390,187,1/10/2000,Faber and Faber
11693,The White Castle,Orhan Pamuk/Victoria Rowe Holbrook,3.46,0571164668,9780571164660,eng,161,6994,431,7/26/2000,Faber and Faber
19243,New Selected Poems 1966-1987,Seamus Heaney,4.19,0571143725,9780571143726,eng,246,356,19,3/4/2002,Faber and Faber
19485,The Book of Illusions,Paul Auster,3.85,0571212182,9780571212187,eng,336,486,57,9/4/2003,Faber and Faber
23046,The Buddha of Suburbia,Hanif Kureishi,3.73,0571200435,9780571200436,en-US,284,384,25,4/5/2000,Faber and Faber
28634,Immortality,Milan Kundera/Peter Kussi,4.14,057114456X,9780571144563,eng,400,21769,803,1/3/1998,Faber and Faber
28920,A Pale View of Hills,Kazuo Ishiguro,3.74,0571225373,9780571225378,eng,183,12858,1036,3/3/2005,Faber and Faber
8969,Sister Freaks: Stories of Women Who Gave Up Everything for God,Rebecca St. James/Mary E. DeMuth/Tracey Lawrence/Elizabeth Jusino,4.12,0446695602,9780446695602,en-US,320,492,32,10/5/2005,FaithWords
40504,Once a Warrior (Warriors  #1),Karyn Monk,3.75,0553574221,9780553574227,eng,384,309,20,3/31/1997,Fanfare
38330,El Borbah,Charles Burns,3.94,1560976934,9781560976936,en-US,96,740,34,1/17/2006,Fantagraphics
36319,The Art of H.P. Lovecraft's the Cthulhu Mythos,Pat Harrigan/Brian  Wood/Jeremy McHugh,4.05,1589943074,9781589943070,eng,191,140,9,10/31/2006,Fantasy Flight Games
27425,The Georgics of Virgil,Virgil/David Ferry,3.85,0374530319,9780374530310,eng,224,85,12,5/2/2006,Farrar  Straus & Giroux
27427,The Eclogues of Virgil,Virgil/David Ferry,3.91,0374526966,9780374526962,eng,112,74,12,6/15/2000,Farrar  Straus & Giroux
27719,The Night of Wishes,Michael Ende/Heike Schwarzbauer/Rick Takvorian/Regina Kehn/Regina Jehn,4.12,0374455031,9780374455033,eng,216,3014,56,4/17/1995,Farrar  Straus and Giroux (BYR)
1911,The World Is Flat: A Brief History of the Twenty-first Century,Thomas L. Friedman,3.68,0374292795,9780374292799,eng,616,87570,2800,4/18/2006,Farrar  Straus and Giroux (NY)
75,Uncommon Carriers,John McPhee,3.95,0374280398,9780374280390,en-US,248,1630,203,5/16/2006,Farrar Straus Giroux
77,The Control of Nature,John McPhee,4.24,0374522596,9780374522599,en-US,288,3498,305,9/1/1990,Farrar Straus Giroux
79,Coming Into the Country,John McPhee,4.22,0374522871,9780374522872,eng,448,5704,261,4/1/1991,Farrar Straus Giroux
81,Giving Good Weight,John McPhee,4.23,0374516006,9780374516000,eng,288,542,36,4/1/1994,Farrar Straus Giroux
421,The White Album,Joan Didion,4.17,0374522219,9780374522216,eng,222,11889,738,10/1/1990,Farrar Straus Giroux
428,Play It As It Lays,Joan Didion/David Thomson,3.87,0374529949,9780374529949,eng,231,23656,1706,11/15/2005,Farrar Straus Giroux
1374,The Iliad,Homer/Robert Fitzgerald/Andrew Ford,3.86,0374529051,9780374529055,en-US,588,692,81,4/3/2004,Farrar Straus Giroux
1382,The Odyssey,Homer/Robert Fitzgerald/D.S. Carne-Ross,3.76,0374525749,9780374525743,eng,515,1713,179,11/5/1998,Farrar Straus Giroux
3066,The Fixer,Bernard Malamud/Jonathan Safran Foer,3.96,0374529388,9780374529383,eng,335,8624,409,5/5/2004,Farrar Straus Giroux
3072,The Tenants,Bernard Malamud/Aleksandar Hemon,3.65,0374521026,9780374521028,eng,248,662,50,9/18/2003,Farrar Straus Giroux
3914,Sylvia,Leonard Michaels/Diane Johnson,3.86,0374271070,9780374271077,eng,129,807,95,5/29/2007,Farrar Straus Giroux
4934,The Brothers Karamazov,Fyodor Dostoyevsky/Fyodor Dostoevsky/Richard Pevear/Larissa Volokhonsky,4.32,0374528373,9780374528379,eng,796,191531,6795,6/14/2002,Farrar Straus Giroux
12172,Memoirs of Hadrian,Marguerite Yourcenar/Grace Frick,4.25,0374529264,9780374529260,eng,347,10455,660,5/18/2005,Farrar Straus Giroux
14031,Palm-of-the-Hand Stories,Yasunari Kawabata/Lane Dunlop/J. Martin Holman,3.99,0374530491,9780374530495,eng,288,1777,129,11/14/2006,Farrar Straus Giroux
15647,The Inferno of Dante: A New Verse Translation (Bilingual Edition),Dante Alighieri/Robert Pinsky/Michael Mazur,4.00,0374525315,9780374525316,mul,464,657,94,9/1/1997,Farrar Straus Giroux
17125,One Day in the Life of Ivan Denisovich,Aleksandr Solzhenitsyn/H.T. Willetts,3.95,0374529523,9780374529529,eng,182,73577,2521,3/16/2005,Farrar Straus Giroux
19564,The Lost Lunar Baedeker: Poems of Mina Loy,Mina Loy/Roger L. Conover,4.17,0374525072,9780374525071,eng,256,1469,63,4/8/1997,Farrar Straus Giroux
19897,The Deltoid Pumpkin Seed,John McPhee,3.95,0374516359,9780374516352,eng,192,380,18,9/1/1992,Farrar Straus Giroux
22994,Selected Verse,Federico Garc√≠a Lorca/Christopher Maurer,4.43,0374528551,9780374528553,eng,432,189,14,6/9/2004,Farrar Straus Giroux
24920,The Discomfort Zone: A Personal History,Jonathan Franzen,3.40,0374299196,9780374299194,eng,195,4760,532,9/5/2006,Farrar Straus Giroux
25743,The Slave,Isaac Bashevis Singer/Cecil Hemley,4.18,0374506809,9780374506803,eng,320,2040,150,10/1/1988,Farrar Straus Giroux
27500,Middlesex,Jeffrey Eugenides,4.00,0965045641,9780965045643,eng,529,1081,228,9/4/2002,Farrar Straus Giroux
27897,On a Dark Night I Left My Silent House,Peter Handke/Krishna Winston,3.27,0374175470,9780374175474,eng,186,179,14,11/8/2000,Farrar Straus Giroux
28948,Gimpel the Fool and Other Stories,Isaac Bashevis Singer/Saul Bellow/Allegra Goodman,4.16,0374530254,9780374530259,eng,224,1715,63,1/10/2006,Farrar Straus Giroux
30755,The Stories (So Far),Deborah Eisenberg,4.00,0374524920,9780374524920,eng,496,209,19,3/13/1997,Farrar Straus Giroux
32765,Gimpel the Fool: And Other Stories,Isaac Bashevis Singer/Saul Bellow,4.16,0374500525,9780374500528,eng,205,37,4,12/31/1988,Farrar Straus Giroux
3068,The Assistant,Bernard Malamud/Jonathan Rosen,3.89,0374504849,9780374504847,en-US,246,8073,319,7/7/2003,Farrar Straus and Giroux
25407,That Same Flower: Floria Aemilia's Letter to St. Augustine,Jostein Gaarder/Anne   Born,3.67,0374253846,9780374253844,eng,167,70,12,2/28/1998,Farrar Straus and Giroux
3751,Moonraker's Bride,Madeleine Brent,4.31,0449235947,9780449235942,eng,319,55,13,6/12/1978,Fawcett
6286,Murder in Foggy Bottom (Capital Crimes  #17),Margaret Truman,3.71,0449001962,9780449001967,en-US,368,688,46,1/29/2002,Fawcett
6568,Asylum (Blackstone Chronicles  #6),John Saul,4.10,0449227944,9780449227947,eng,97,932,24,6/3/1997,Fawcett
8581,A Jockey's Life: The Biography of Lester Piggott,Dick Francis,3.59,0449213307,9780449213308,eng,468,82,2,7/12/1987,Fawcett
16782,The Case of the Curious Bride (Perry Mason Mystery),Erle Stanley Gardner,3.87,0345437837,9780345437839,eng,192,1559,61,1/4/2000,Fawcett
21114,The Capricorn Stone,Madeleine Brent,3.91,044920149X,9780449201497,eng,346,574,33,5/12/1983,Fawcett
29960,Winter of Magic's Return,Pamela F. Service,4.25,0449702022,9780449702024,eng,194,235,18,11/12/1986,Fawcett
36255,The Hearth and Eagle,Anya Seton,3.89,0449236412,9780449236413,eng,476,569,26,9/12/1980,Fawcett
42819,A Pirate Looks at Fifty,Jimmy Buffett/Leona Nevler,3.83,0449005860,9780449005866,eng,420,3036,216,11/28/1999,Fawcett
42959,The Bridge at Andau,James A. Michener,3.94,0449210502,9780449210505,en-US,288,1135,158,9/12/1985,Fawcett
3825,Death in Holy Orders (Adam Dalgliesh  #11),P.D. James/Christa Seibicke,3.92,0345446666,9780345446664,eng,429,9847,516,3/26/2002,Fawcett Books
8548,Driving Force,Dick Francis,3.96,0449221393,9780449221396,eng,384,2635,107,12/29/1993,Fawcett Books
16763,The Case of the Glamorous Ghost (Perry Mason),Erle Stanley Gardner,3.89,0345437861,9780345437860,eng,232,604,35,2/29/2000,Fawcett Books
26292,The Chairman (Christian Gillette  #1),Stephen W. Frey,3.98,0345457617,9780345457615,eng,415,2173,89,12/27/2005,Fawcett Books
27051,Lights Out,Peter Abrahams,3.65,0345445783,9780345445780,eng,352,208,16,6/25/2002,Fawcett Books
42955,The Drifters,James A. Michener,4.04,0449213536,9780449213537,eng,768,6253,353,10/12/1986,Fawcett Books
42916,All Quiet on the Western Front,Erich Maria Remarque,3.97,0449231801,9780449231807,en-GB,256,64,4,3/12/1987,Fawcett Crest
12664,Iberia,James A. Michener/Robert Vavra,3.71,0449207331,9780449207338,eng,960,2153,152,10/12/1984,Fawcett Crest Books
44759,Curse Of The Kings,Victoria Holt,3.76,044920068X,9780449200681,eng,304,15,1,6/12/1985,Fawcett Crest Books
37377,On the Night You Were Born,Nancy Tillman,4.36,0312346069,9780312346065,en-US,32,12837,505,10/17/2006,Feiwel & Friends
32750,Brown Girl  Brownstones,Paule Marshall/Mary Helen Washington/Edwidge Danticat,4.07,1558614982,9781558614987,eng,324,2466,107,8/1/2006,Feminist Press
40919,Big Dead Place: Inside the Strange and Menacing World of Antarctica,Nicholas Johnson/Eirik Sonneland,3.72,0922915997,9780922915996,eng,260,436,95,6/1/2005,Feral House
30480,The Communist Manifesto,Karl Marx/Friedrich Engels,3.55,1599869950,9781599869957,en-US,88,138,18,12/26/2005,Filiquarian Publishing  LLC.
25941,Le Chef-D'≈íuvre Inconnu,Honor√© de Balzac,3.87,2868050131,9782868050137,fre,49,10,0,1/19/1998,Findakly
59,The Changeling Sea,Patricia A. McKillip,4.06,0141312629,9780141312620,eng,137,4454,302,4/14/2003,Firebird
4580,Enchantress from the Stars,Sylvia Engdahl/Lois Lowry,3.95,0142500372,9780142500378,eng,304,2045,230,2/24/2003,Firebird
7983,Salamandastron (Redwall  #5),Brian Jacques/Gary Chalk,4.07,0142501522,9780142501528,en-US,400,26237,240,9/15/2003,Firebird
7998,Outcast of Redwall (Redwall  #8),Brian Jacques,3.92,0142401420,9780142401422,en-US,368,17597,188,5/24/2004,Firebird
8091,The Door in the Hedge,Robin McKinley,3.68,0698119606,9780698119604,eng,224,7941,419,10/13/2003,Firebird
19818,Moon-Flash (Kyreol  #1-2),Patricia A. McKillip,3.74,0142403016,9780142403013,eng,304,348,13,3/17/2005,Firebird
40160,Firebirds: An Anthology of Original Fantasy and Science Fiction,Sharyn November/Lloyd Alexander/Emma Bull/Charles Vess/Michael Cadnum/Kara Dalkey/Nancy Farmer/Nina Kiriki Hoffman/Diana Wynne Jones/Patricia A. McKillip/Garth Nix/Meredith Ann Pierce/Delia Sherman/Sherwood Smith/Nancy Springer/Megan Whalen Turner/Elizabeth Wein/Laurel Winter,3.96,0142403202,9780142403204,eng,432,3464,153,5/5/2005,Firebird
24783,Westmark (Westmark  #1),Lloyd Alexander,3.92,0141310685,9780141310688,eng,184,4222,180,1/14/2002,Firebird Books
26571,The Kestrel (Westmark  #2),Lloyd Alexander,3.98,0141310693,9780141310695,eng,244,2742,104,6/10/2002,Firebird Books
1022,Read My Lips: Sexual Subversion and the End of Gender,Riki Anne Wilchins,3.95,1563410907,9781563410901,en-US,288,253,17,6/1/2005,Firebrand Books
35553,Shout! The Beatles in Their Generation,Philip Norman,4.03,0743235657,9780743235655,eng,546,4624,137,2/15/2005,Fireside
42738,The Snapper,Roddy Doyle,3.93,3596153034,9783596153039,ger,217,26,5,9/1/2002,Fischer TB
24010,Laguna  I Love You: The Best of "Our Town",John Weld/Phil Interlandi,0.00,1564741575,9781564741578,eng,285,0,0,3/1/1996,Fithian Press
5712,If I Die in a Combat Zone,Tim O'Brien,3.95,0007162995,9780007162994,eng,208,11,0,4/7/2003,Flamingo
14485,Directing the Documentary,Michael Rabiger,4.23,0240806085,9780240806082,en-US,648,183,24,3/30/2004,Focal Press
32039,Avid Editing: A Guide for Beginning and Intermediate Users,Sam Kauffmann,3.83,0240805410,9780240805412,en-US,414,5,0,3/17/2003,Focal Press
43166,Practical DV Filmmaking,Russell Evans,3.46,0240807383,9780240807386,en-US,408,9,0,11/1/2005,Focal Press
6346,Phaedo,Plato/Eva Brann/Peter Kalkavage/Eric Salem,4.04,0941051692,9780941051699,eng,118,94,12,9/1/1998,Focus
34435,The Theban Plays: Antigone  King Oidipous & Oidipous at Colonus (Focus Classical Library),Sophocles/Ruby Blondell,3.97,1585100374,9781585100378,en-US,248,57,3,12/1/2001,Focus
1568,Acharnians,Aristophanes/Jeffrey Henderson,3.42,1585100870,9781585100873,eng,96,23,1,5/1/2003,Focus Publishing/R. Pullins Company
34783,Boomers  Xers  and Other Strangers: Understanding the Generational Differences that Divide Us,Rick Hicks/Kathy Hicks,3.36,1561796778,9781561796779,eng,384,28,4,10/1/1999,Focus on the Family Publishing
19531,Les Mandarins: Tome 2,Simone de Beauvoir,4.20,2070367703,9782070367702,fre,500,98,10,6/9/1972,Folio
21126,La force de l'√¢ge,Simone de Beauvoir,4.15,2070377822,9782070377824,fre,786,192,17,11/14/1986,Folio
966,Angeles & Demonios,Dan Brown/Ra√∫l Amundaray,3.89,0972859896,9780972859899,spa,18,65,7,12/1/2005,FonoLibro
22868,The One Tree (The Second Chronicles of Thomas Covenant  #2),Stephen R. Donaldson,3.98,0006163831,9780006163831,en-GB,479,174,3,11/18/1996,Fontana
34873,The Great And Secret Show (Book of the Art #1),Clive Barker,4.05,000617695X,9780006176954,eng,698,275,17,4/26/1990,Fontana Books
672,Sailing for Dummies,J.J. Isler/Peter Isler,3.95,0471791431,9780471791430,eng,416,150,7,6/1/2006,For Dummies
3603,Personal Finance For Dummies,Eric Tyson,3.77,0470038322,9780470038321,en-GB,458,114,15,10/1/2006,For Dummies
40551,PHP and MySQL for Dummies,Janet Valade,3.55,0764555898,9780764555893,en-US,456,12,2,4/9/2004,For Dummies
40816,Turtles & Tortoises for Dummies,Liz Palika,3.57,0764553135,9780764553134,eng,328,53,5,3/15/2001,For Dummies
7966,Rebekah (Women of Genesis  #2),Orson Scott Card,3.84,076534128X,9780765341280,eng,416,7487,617,3/27/2012,Forge
7959,Rachel & Leah (Women of Genesis  #3),Orson Scott Card,3.85,0765341298,9780765341297,en-GB,368,5618,514,11/29/2005,Forge Books
7961,Saints,Orson Scott Card,3.54,0312876068,9780312876067,eng,608,2436,268,3/14/2001,Forge Books
32307,Blame It on Paris,Laura Florand,3.53,0765315084,9780765315083,eng,384,358,63,10/3/2006,Forge Books
33550,Noir: Three Novels of Suspense,Richard Matheson,3.69,0765311402,9780765311405,eng,385,150,14,10/1/2005,Forge Books
6654,Divine Conspiracy: Rediscovering Our Hidden Life in God,Dallas Willard,4.22,0006281141,9780006281146,en-US,384,52,2,10/5/1998,Fount
35561,The Beatles' Story on Capitol Records  Part Two: The Albums,Bruce Spizer,4.72,0966264924,9780966264920,eng,264,29,0,1/1/2010,Four Ninety-Eight Productions
29593,A Place So Foreign and Eight More,Cory Doctorow/Bruce Sterling,3.72,1568582862,9781568582863,eng,243,860,43,9/8/2003,Four Walls Eight Windows Press
10670,When Genius Failed: The Rise And Fall Of Long Term Capital Management,Roger Lowenstein,4.19,1841155047,9781841155043,eng,275,247,13,6/1/2009,Fourth Estate
12827,Strong Motion,Jonathan Franzen,3.52,184115749X,9781841157498,eng,528,3996,278,6/1/2007,Fourth Estate (GB)
3805,The Corrections,Jonathan Franzen,3.79,1841156736,9781841156736,eng,653,133237,7468,9/2/2002,Fourth Estate Paperbacks
9338,Insights: Talks On The Nature Of Existence,Frederick P. Lenz,0.00,1932206086,9781932206081,eng,304,0,0,1/1/2003,Frederick P. Lenz Foundation for American Buddhism
32832,The Lighthouse at the End of the World,Jules Verne,3.64,1589630947,9781589630949,eng,260,1752,40,3/20/2001,Fredonia Books (NL)
32835,The End of Nana Sahib: The Steam House (Extraordinary Voyages  #20),Jules Verne/Agnes D. Kingston,3.59,1410103277,9781410103277,eng,276,199,9,7/19/2003,Fredonia Books (NL)
32849,Adrift in the Pacific: Two Years Holiday (Extraordinary Voyages  #32),Jules Verne,3.99,1410102157,9781410102157,eng,300,1956,39,4/24/2003,Fredonia Books (NL)
2249,The Seven Habits of Highly Effective People,Stephen R. Covey,4.10,0671708635,9780671708634,eng,368,2505,233,9/15/1990,Free Press
2761,The Denial of Death,Ernest Becker/Sam Keen/Daniel Goleman,4.16,0684832402,9780684832401,eng,336,6599,635,5/8/1997,Free Press
4764,Soul of the Sword: An Illustrated History of Weaponry and Warfare from Prehistory to the Present,Robert L. O'Connell/John    Batchelor,3.75,0684844079,9780684844077,en-US,400,55,5,8/27/2002,Free Press
7697,Persian Mirrors: The Elusive Face of Iran,Elaine Sciolino,3.82,0743284798,9780743284790,eng,432,546,53,10/3/2005,Free Press
15173,The Used World,Haven Kimmel,3.63,0743247787,9780743247788,eng,308,1398,249,9/18/2007,Free Press
17632,Tyranny of the Majority: Fundamental Fairness in Representative Democracy,Lani Guinier/Stephen L. Carter,3.87,0029131693,9780029131695,eng,352,41,3,2/1/1995,Free Press
22493,The Origins of the Civil Rights Movements: Black Communities Organizing for Change,Aldon D. Morris,4.05,0029221307,9780029221303,en-US,368,151,13,9/15/1986,Free Press
22633,The Trial of Queen Caroline: The Scandalous Affair that Nearly Ended a Monarchy,Jane Robins,3.39,0743255909,9780743255905,eng,384,52,8,8/7/2006,Free Press
23017,Presidential Power and the Modern Presidents: The Politics of Leadership from Roosevelt to Reagan,Richard E. Neustadt,3.77,0029227968,9780029227961,eng,384,293,17,3/1/1991,Free Press
28213,The Band Played Dixie: Race and the Liberal Conscience at Ole Miss,Nadine Cohodas,3.96,0684827212,9780684827216,eng,309,46,5,5/5/1997,Free Press
