11033,The Seville Communion,Arturo P√©rez-Reverte/Sonia Soto,3.68,0156029812,9780156029810,eng,400,3912,209,6/7/2004,Mariner Books
11037,The Diary of Ana√Øs Nin  Vol. 2: 1934-1939,Ana√Øs Nin/Gunther Stuhlmann,4.18,0156260263,9780156260268,eng,372,1775,47,3/25/1970,Mariner Books
12570,A Confederate General from Big Sur / Dreaming of Babylon / The Hawkline Monster,Richard Brautigan,4.25,0395547032,9780395547038,en-US,608,1724,103,2/4/1991,Mariner Books
12577,The Collected Stories,Eudora Welty,4.23,0156189216,9780156189217,eng,622,7084,202,2/1/1982,Mariner Books
12967,Winter's Tale,Mark Helprin,3.50,0156031191,9780156031196,eng,748,21851,3510,6/1/2005,Mariner Books
14227,The Diezmo,Rick Bass,3.46,0618710507,9780618710508,eng,224,11,1,6/15/2006,Mariner Books
14230,The Hermit's Story,Rick Bass,4.12,0618380442,9780618380442,eng,192,437,45,9/18/2003,Mariner Books
14781,The Chosen: The Hidden History of Admission and Exclusion at Harvard  Yale  and Princeton,Jerome Karabel,4.08,061877355X,9780618773558,eng,736,200,22,9/8/2006,Mariner Books
14945,Moments of Being: A Collection of Autobiographical Writing,Virginia Woolf/Jeanne Schulkind,4.26,0156619180,9780156619189,eng,230,1729,121,8/23/1985,Mariner Books
14947,The Diary of Virginia Woolf  Volume Two: 1920-1924,Virginia Woolf/Anne Olivier Bell/Andrew McNeillie,4.37,0156260379,9780156260374,eng,384,383,11,9/17/1980,Mariner Books
14960,Eden Close,Anita Shreve,3.66,0156031337,9780156031332,en-US,265,8661,447,10/4/2005,Mariner Books
16716,The Wall of the Sky  the Wall of the Eye,Jonathan Lethem,3.67,0156032481,9780156032483,eng,304,1158,95,3/5/2007,Mariner Books
16718,Gun  With Occasional Music,Jonathan Lethem,3.77,0156028972,9780156028974,eng,271,8141,786,9/1/2003,Mariner Books
17841,Foucault's Pendulum,Umberto Eco/William Weaver,3.89,015603297X,9780156032971,eng,623,46598,2074,3/5/2007,Mariner Books
17977,The Ancestor's Tale: A Pilgrimage to the Dawn of Evolution,Richard Dawkins,4.13,061861916X,9780618619160,eng,688,20232,609,9/2/2005,Mariner Books
18350,In Favor of the Sensitive Man and Other Essays,Ana√Øs Nin,4.02,0156444453,9780156444453,eng,180,520,40,4/1/1976,Mariner Books
18518,The Diary of Virginia Woolf  Volume One: 1915-1919,Virginia Woolf/Anne Olivier Bell/Quentin Bell,4.32,0156260360,9780156260367,eng,356,1281,40,5/15/1979,Mariner Books
18520,The Diary of Virginia Woolf  Volume Three: 1925-1930,Virginia Woolf/Anne Olivier Bell/Andrew McNeillie,4.42,0156260387,9780156260381,eng,408,485,14,9/14/1981,Mariner Books
18753,The World's Last Night: And Other Essays,C.S. Lewis,4.18,0156027712,9780156027717,en-GB,132,1097,117,11/4/2002,Mariner Books
18834,Beginning Again: An Autobiography of The Years 1911 to 1918,Leonard Woolf,3.81,0156116804,9780156116800,eng,263,64,8,10/18/1989,Mariner Books
18840,The Common Reader,Virginia Woolf/Andrew McNeillie,4.16,015602778X,9780156027786,eng,272,1136,58,11/4/2002,Mariner Books
18853,The Letters of Virginia Woolf: Volume Four  1929-1931,Virginia Woolf/Nigel Nicolson/Joanne Trautmann,4.41,0156508842,9780156508841,en-US,480,106,2,5/15/1981,Mariner Books
18930,The Uses of Literature,Italo Calvino/Patrick Creagh,4.07,0156932504,9780156932509,eng,341,900,32,10/21/1987,Mariner Books
20807,Inventing America: Jefferson's Declaration of Independence,Garry Wills,3.93,0618257764,9780618257768,eng,432,161,16,11/14/2002,Mariner Books
21545,The Best American Mystery Stories 2003,Michael Connelly/Otto Penzler,3.60,0618390723,9780618390724,eng,1,5,2,11/4/2003,Mariner Books
21685,A Drink Before the War (Kenzie & Gennaro  #1),Dennis Lehane,3.95,0156029022,9780156029025,eng,282,29089,1523,9/15/2003,Mariner Books
21703,The Best American Mystery Stories 2002,James Ellroy/Otto Penzler/John Biguenet/Michael Connelly/Thomas H. Cook/Sean Doolittle/Brendan DuBois/David Edgerley Gates/Joe Gores/James Grady/Clark Howard/Stuart M. Kaminsky/Joe R. Lansdale/Michael Malone/Annette Meyers/Joyce Carol Oates/Robert B. Parker/F.X. Toole/Daniel Waterman/Scott Wolven/Fred Melton,3.58,0618258078,9780618258079,eng,1,0,0,10/15/2002,Mariner Books
22478,The Origin of Consciousness in the Breakdown of the Bicameral Mind,Julian Jaynes,4.25,0618057072,9780618057078,eng,491,3473,426,8/15/2000,Mariner Books
23203,Pilgrims Pa,Elizabeth Gilbert,3.13,0395924855,9780395924853,eng,224,10,2,9/17/1998,Mariner Books
23588,J.R.R. Tolkien: Artist and Illustrator,Wayne G. Hammond/Christina Scull/J.R.R. Tolkien,4.14,0618083618,9780618083619,en-US,224,8140,32,10/18/2000,Mariner Books
25587,The Second World War,Winston S. Churchill/John Keegan,4.45,039541685X,9780395416853,eng,4736,1493,99,5/9/1986,Mariner Books
27345,The House of Life: Rachel Carson at Work,Paul Brooks/Rachel Carson,3.95,0395517427,9780395517420,eng,350,10,1,10/18/1989,Mariner Books
27668,Bury the Chains,Adam Hochschild,4.28,0618619070,9780618619078,eng,496,1342,178,2/10/2006,Mariner Books
28769,Tales of Pirx the Pilot,Stanis≈Çaw Lem/Louis Iribarne,4.10,0156881500,9780156881500,eng,216,3941,71,11/30/1990,Mariner Books
28865,Le Petit Prince,Antoine de Saint-Exup√©ry,4.31,0156013983,9780156013987,fre,87,3045,215,9/4/2001,Mariner Books
30810,Reefer Madness: Sex  Drugs  and Cheap Labor in the American Black Market,Eric Schlosser,3.78,0618446702,9780618446704,eng,352,5330,353,4/1/2004,Mariner Books
31818,The Philosophy of Andy Warhol (From A to B and Back Again),Andy Warhol,3.74,0156717204,9780156717205,eng,272,33697,402,4/6/1977,Mariner Books
31960,The Best American Sports Writing 2003,Buzz Bissinger/Glenn Stout/Elizabeth Gilbert/Bill Plaschke/Gary Smith/Michael J. Agovino,3.87,0618251324,9780618251322,eng,352,53,2,10/10/2003,Mariner Books
32281,Demonic Males: Apes and the Origins of Human Violence,Richard W. Wrangham/Dale Peterson,4.03,0395877431,9780395877432,en-US,368,686,64,11/14/1997,Mariner Books
33917,The Namesake,Jhumpa Lahiri,3.99,0618485228,9780618485222,eng,291,213178,10160,9/1/2004,Mariner Books
34407,The Pirates Laffite: The Treacherous World of the Corsairs of the Gulf,William C. Davis,3.50,0156032597,9780156032599,eng,756,217,37,5/1/2006,Mariner Books
37380,The Heart Is a Lonely Hunter,Carson McCullers,3.98,0618084746,9780618084746,eng,359,77530,4685,9/8/2000,Mariner Books
39535,Fabulous Small Jews,Joseph Epstein,3.90,0618446583,9780618446582,en-US,352,192,29,7/6/2004,Mariner Books
41033,The Best American Mystery Stories 2004,Nelson DeMille/Otto Penzler,3.55,0618329676,9780618329670,eng,448,100,13,10/14/2004,Mariner Books
44146,Maigret in Holland,Georges Simenon,3.59,0156028522,9780156028523,en-US,180,265,20,6/16/2003,Mariner Books
44148,Maigret and the Killer,Georges Simenon/Lyn Moir,3.86,0156028417,9780156028417,en-US,168,471,29,6/16/2003,Mariner Books
44156,The Man Who Wasn't Maigret: A Portrait of Georges Simenon,Patrick Marnham,4.08,0156000598,9780156000598,eng,404,44,7,4/15/1994,Mariner Books
44162,Maigret and the Headless Corpse,Georges Simenon/Eileen Ellenbogen,3.81,0156551446,9780156551441,eng,196,392,37,6/26/1985,Mariner Books
44505,The Best American Essays 2006,Lauren Slater/Robert Atwan,3.88,0618705295,9780618705290,en-US,304,434,34,10/11/2006,Mariner Books
44509,The Best American Travel Writing 2006,Tim Cahill,3.94,0618582150,9780618582150,eng,352,492,47,10/11/2006,Mariner Books
44543,Slammerkin,Emma Donoghue,3.71,0156007479,9780156007474,eng,410,12551,1251,5/1/2002,Mariner Books
44628,The Last Shot: City Streets  Basketball Dreams,Darcy Frey,4.17,0618446710,9780618446711,en-CA,233,5106,155,3/3/2004,Mariner Books
25192,Teach Us To Outgrow Our Madness,Kenzabur≈? ≈åe/John Nathan,3.86,0714530484,9780714530482,eng,276,44,1,3/4/2000,Marion Boyars Publishers
15087,Alfred Hitchcock and the Making of Psycho,Stephen Rebello,3.90,0714530034,9780714530031,en-GB,224,13,0,1/1/1998,Marion Boyars Publishers Ltd
15704,Notebooks  1935-1951,Albert Camus/Philip Thody/Justin O'Brien,4.28,1569246661,9781569246665,eng,496,553,12,9/1/1998,Marlowe & Company
12117,One  No One and One Hundred Thousand,Luigi Pirandello/William Weaver/Samuel Putnam,4.10,0941419746,9780941419741,eng,176,3852,106,9/1/1992,Marsilio Publishers
32702,Rabia,Richard Bachman/Stephen King/Hern√°n Sabat√© Vargas,3.78,8427011504,9788427011502,spa,203,91,22,9/1/1987,Mart√≠nez Roca
3940,Supreme Power: Hyperion,J. Michael Straczynski/Dan Jurgens,3.45,0785118950,9780785118954,eng,120,232,9,7/19/2006,Marvel
7389,Runaways  Vol. 1: Pride and Joy,Brian K. Vaughan/Adrian Alphona,3.97,0785113797,9780785113799,eng,144,24754,859,12/6/2006,Marvel
15719,Marvel 1602,Neil Gaiman/Andy Kubert/Richard Isanove/Peter Sanderson/Todd Klein,3.94,0785123113,9780785123118,eng,248,48894,1354,8/2/2006,Marvel
21280,Ultimate Annuals  Volume 2,Charlie Huston/Mike Carey/Brian Michael Bendis/Robert Kirkman/Mike Deodato/Ryan Sook/Stuart Immonen/Frazier Irving,3.21,0785123717,9780785123712,eng,160,105,8,2/7/2007,Marvel
21321,Ultimate Spider-Man  Volume 7,Brian Michael Bendis/Mark Bagley,4.10,078512148X,9780785121480,eng,344,272,9,10/4/2006,Marvel
22345,New X-Men  Volume 4: Riot at Xavier's,Grant Morrison/Frank Quitely,4.06,0785110674,9780785110675,eng,120,2113,54,11/15/2006,Marvel
22351,New X-Men  Volume 1: E Is for Extinction,Grant Morrison/Frank Quitely,4.06,0785108114,9780785108115,eng,144,7602,135,9/27/2006,Marvel
22365,New X-Men: Omnibus,Grant Morrison/Marc Silvestri/Chris Bachalo/John Paul Leon/Frank Quitely/Leinil Francis Yu/Igor Kordey/Ethan Van Sciver/Keron Grant/Tom Derenick/Phil Jimenez,4.23,0785123261,9780785123262,eng,1096,2952,112,12/6/2006,Marvel
22392,New X-Men  Volume 7: Here Comes Tomorrow,Grant Morrison/Marc Silvestri,3.75,0785113452,9780785113454,eng,112,1797,55,11/15/2006,Marvel
31979,Astonishing X-Men  Volume 1: Gifted,Joss Whedon/John Cassaday,4.17,0785115315,9780785115311,eng,152,24262,557,5/10/2006,Marvel
31981,Astonishing X-Men  Volume 3: Torn,Joss Whedon/John Cassaday,4.24,0785117598,9780785117599,eng,152,8900,241,2/14/2007,Marvel
40451,Black Widow: The Things They Say About Her,Richard K. Morgan/Bill Sienkiewicz/Sean Phillips,3.47,0785117687,9780785117681,eng,144,302,33,6/7/2006,Marvel
43739,Iron Man: Extremis,Warren Ellis/Adi Granov,4.09,0785122583,9780785122586,eng,160,10792,290,2/14/2007,Marvel
16982,Marvels,Kurt Busiek/Alex Ross,4.22,0785100490,9780785100492,eng,216,23519,482,1/10/2007,Marvel Comics
35248,Essential Monster of Frankenstein  Vol. 1,Gary Friedrich/Doug Moench/John Buscema/Mike Ploog/Val Mayerick,3.62,0785116346,9780785116349,eng,496,69,7,10/20/2004,Marvel Comics
41179,Miracleman  Book Three: Olympus,Alan Moore/John Totleben/Steve Oliff/Joe Caramagna/Michael Kelleher/Peter Milligan/Mike Allred,4.39,1560600802,9781560600800,eng,328,1768,93,4/21/2015,Marvel Comics
16993,Fantastic Four  Volume 2,Mark Waid/Mike Wieringo/Howard Porter,3.92,078511775X,9780785117759,eng,264,96,8,3/16/2005,Marvel Comics Group
16995,Fantastic Four  Volume 3,Mark Waid/Mike Wieringo,3.95,0785120114,9780785120117,eng,256,118,5,11/23/2005,Marvel Comics Group
16999,Fantastic Four  Vol 5: Disassembled,Mark Waid/Paco Medina,3.28,0785115366,9780785115366,eng,136,192,13,1/1/2005,Marvel Comics Group
26673,The Punisher  Vol. 6: Confederacy of Dunces,Garth Ennis,4.00,0785113444,9780785113447,eng,144,289,11,4/1/2004,Marvel Comics Group
43725,NextWave: Agents of H.A.T.E.  Vol. 1: This is What They Want,Warren Ellis/Stuart Immonen/Wade Von Grawbadger/Dave McCaig,4.16,0785122788,9780785122784,eng,144,4119,184,9/13/2006,Marvel Comics Group
4943,Hungry Planet,Peter Menzel/Faith D'Aluisio,4.44,1580086810,9781580086813,eng,288,1455,193,10/1/2005,Material World
9464,A Guided Tour of 5 Works by Plato: Euthyphro/Apology/Crito/Phaedo/Cave,Christopher Biffle/Plato,4.33,1559343567,9781559343565,eng,125,9,1,12/28/1995,Mayfield Publishing Company (NY)
31670,The Jane Austen Cookbook,Maggie Black/Deirdre Le Faye,3.93,0771014171,9780771014178,eng,128,275,26,5/10/2002,McClelland & Stewart
20157,McDougal Littell Science: Student Edition Grade 6 Earth Science 2006,McDougal Littell/Douglas W. Carnine,2.00,0618615385,9780618615384,eng,972,3,0,4/12/2005,McDougal Littel
29965,The War of the Worlds,H.G. Wells/Leon Stover,3.82,0786407808,9780786407804,eng,321,16,1,4/30/2001,McFarland & Company
26407,The Philosophy of Hegel,Georg Wilhelm Friedrich Hegel/Carl Joachim Friedrich,3.37,0075536552,9780075536550,eng,552,15,4,2/1/1965,McGraw-Hill
43536,Wooden: A Lifetime of Observations and Reflections On and Off the Court,John Wooden/Steve Jamison,4.45,0809230410,9780809230419,eng,201,3429,274,4/22/1997,McGraw-Hill
25639,McGraw-Hill's SAT I (McGraw-Hill's SAT I),Christopher   Black/Mark Anestis,3.67,007146235X,9780071462358,eng,890,0,0,10/1/2005,McGraw-Hill Companies
33671,Virgin,James Patterson,3.86,0070488207,9780070488205,eng,210,307,28,1/1/1980,McGraw-Hill Companies
40146,"Dear Genius...": A Memoir of My Life with Truman Capote,Jack Dunphy,3.33,0070183171,9780070183179,eng,275,36,6,12/1/1987,McGraw-Hill Companies
42863,Mission Possible,Kenneth H. Blanchard,3.44,0071348271,9780071348270,eng,242,0,0,4/30/1999,McGraw-Hill Companies
2595,Marketing Warfare,Al Ries/Jack Trout,4.11,0071460829,9780071460828,eng,216,942,59,12/13/2005,McGraw-Hill Education
22562,Slim to None: A Journey Through the Wasteland of Anorexia Treatment,Jennifer Hendricks/Gordon Hendricks,3.63,0071433716,9780071433716,eng,384,580,21,2/4/2004,McGraw-Hill Education
27247,The Complete Book of Home  Site and Office Security: Selecting  Installing and Troubleshooting Systems and Devices,Bill   Phillips,3.50,0071467440,9780071467445,eng,309,2,0,8/1/2006,McGraw-Hill Education
2228,The Last Dance: Encountering Death and Dying,Lynne Ann DeSpelder/Albert Lee Strickland,3.77,0072920963,9780072920963,eng,664,123,13,2/6/2004,McGraw-Hill Humanities/Social Sciences/Languages
3293,Diez Cuentos de Eva Luna Con Guia de Comprension y Repaso de Gramatica,Isabel Allende/Richard D. Woods/Kenneth M. Taggart,3.97,007001356X,9780070013568,eng,256,10,1,12/1/1994,McGraw-Hill Humanities/Social Sciences/Languages
25688,Complete Works of Tacitus,Tacitus/Alfred J. Church/William Jackson Brodribb/Moses Hadas,4.29,0075536390,9780075536390,eng,773,280,13,9/1/1964,McGraw-Hill Humanities/Social Sciences/Languages
30258,Harrison's Principles of Internal Medicine,Dennis L. Kasper/Dan L. Longo/Stephen L. Hauser/Anthony S. Fauci/Eugene Braunwald,4.35,0071391401,9780071391405,eng,2751,23,4,7/27/2004,McGraw-Hill Medical Publishing
40012,Goodman & Gilman's the Pharmacological Basis of Therapeutics,Laurence L. Brunton/John S. Lazo/Keith  L. Parker,4.29,0071422803,9780071422802,eng,2021,185,8,9/21/2005,McGraw-Hill Professional Publishing
25252,Von Helden Und Schelmen: Tall Tales and Legends for Intermediate Students of German,Kurt Reiter,4.00,0844222593,9780844222592,ger,88,4,2,1/1/1989,McGraw-Hill/Glencoe
4260,The Polysyllabic Spree,Nick Hornby,3.73,1932416242,9781932416244,eng,143,6828,621,11/30/2004,McSweeney's
4952,What Is the What,Dave Eggers,4.16,1932416641,9781932416640,eng,475,65767,6203,10/18/2006,McSweeney's
4956,How We Are Hungry: Stories,Dave Eggers,3.75,1932416137,9781932416138,eng,218,488,38,10/13/2004,McSweeney's
15592,McSweeney's #12,Dave Eggers/Roddy Doyle/McSweeney's Publishing,3.87,1932416064,9781932416060,eng,273,188,7,12/1/2003,McSweeney's
28748,The Very Persistent Gappers of Frip,George Saunders/Lane Smith,4.11,1932416374,9781932416374,eng,84,2457,356,3/29/2006,McSweeney's
43419,Surviving Justice: America's Wrongfully Convicted and Exonerated,Scott Turow/Lola Vollen/Dave Eggers,4.29,1932416234,9781932416237,eng,489,264,32,11/4/2005,McSweeney's
43437,McSweeney's #19,Dave Eggers/T. Coraghessan Boyle/Adam Golaski/Sean Casey/Brendan Connell,3.80,193241648X,9781932416480,en-GB,250,305,15,4/10/2006,McSweeney's
19124,Children of the Star (Children of the Star  #1-3),Sylvia Engdahl,4.24,1892065142,9781892065148,eng,728,168,12,1/10/2000,Meisha Merlin Publishing
28658,Traitor's Knot (Wars of Light and Shadow  #7),Janny Wurts,4.20,1592220827,9781592220823,eng,574,434,7,8/30/2006,Meisha Merlin Publishing
3532,First Love,Ivan Turgenev/Constance Garnett,3.78,0974607894,9780974607894,eng,124,5856,310,9/1/2004,Melville House Publishing
8814,A Clockwork Orange (Stage Play),Anthony Burgess,3.84,0413735907,9780413735904,eng,51,28,2,3/10/2017,Methuen Drama
12120,Three Plays,Luigi Pirandello/Robert Rietty/Julian Mitchell/John Linstrum,3.74,0413575608,9780413575609,eng,200,7,0,6/1/1985,Methuen Publishing
12457,Boys' Life & Search and Destroy,Howard Korder,3.76,0413712001,9780413712004,en-GB,160,17,0,12/1/2006,Methuen Publishing
40226,Angels: Celestial Spirits in Legend & Art,Jacqueline Carey,4.00,1567996035,9781567996036,en-US,128,42,3,11/1/1997,MetroBooks (NY)
44269,The American Heritage New History of the Civil War,Bruce Catton/James M. McPherson,4.11,1586631985,9781586631987,eng,630,104,2,10/1/2001,MetroBooks (NY)
7430,The Nubian Prince,Juan Bonilla/Esther Allen,3.54,0805077812,9780805077810,en-US,258,61,10,6/27/2006,Metropolitan Books
8572,Banker,Dick Francis,4.06,0718132386,9780718132385,eng,288,3092,132,10/3/2000,Michael Joseph
41900,J.K. Rowling - A Biography,Sean Smith,3.73,1843170175,9781843170174,eng,248,937,41,5/1/2003,Michael O'Mara Books
43940,Object Thinking,David      West,3.99,0735619654,9780735619654,eng,334,155,21,7/23/2019,Microsoft Press
44882,Code,Charles Petzold,4.39,0735611319,9780735611313,eng,400,4919,418,10/21/2000,Microsoft Press
44916,Writing Secure Code,Michael  Howard/David LeBlanc,4.01,0735617228,9780735617223,en-US,768,328,10,12/14/2002,Microsoft Press
37569,The Buddha in Your Mirror: Practical Buddhism and the Search for Self,Woody Hochswender/Greg Martin/Ted Morino,4.28,0967469783,9780967469782,eng,230,732,72,10/1/2001,Middleway Press
12787,Falling Angel,William Hjortsberg/Ridley Scott/James Crumley,3.92,1933618086,9781933618081,eng,302,2243,220,11/1/2006,Millipede Press
7400,The Baby Emergency (Tennengarrah Clinic #1),Carol Marinelli,3.60,0263181499,9780263181494,eng,285,0,0,6/1/2004,Mills & Boon
4669,The St. Paul Stories of F. Scott Fitzgerald,F. Scott Fitzgerald/Dave Page/Patricia Hampl,4.00,0873515129,9780873515122,en-US,328,100,11,9/24/2004,Minnesota Historical Society Press
7896,Early Candlelight,Maud Hart Lovelace/Rhoda R. Gilman,3.69,0873512693,9780873512695,eng,342,184,30,8/15/1992,Minnesota Historical Society Press
3976,Hard Freeze (Joe Kurtz  #2),Dan Simmons,3.84,0312989482,9780312989484,eng,320,734,44,9/15/2003,Minotaur Books
10221,Death in Berlin,M.M. Kaye,3.89,0312263082,9780312263089,eng,272,889,62,6/8/2000,Minotaur Books
15923,True Believers (Gregor Demarkian  #17),Jane Haddam,3.88,0312982860,9780312982867,eng,432,237,14,4/15/2002,Minotaur Books
16315,Crooked House,Agatha Christie,4.04,031298166X,9780312981662,eng,276,24849,1429,8/19/2002,Minotaur Books
25565,Hot Spot (Mark Manning Mystery  #6),Michael Craft,3.85,0312313640,9780312313647,eng,288,80,1,6/4/2003,Minotaur Books
44230,The Silver Pigs (Marcus Didius Falco  #1),Lindsey Davis,3.94,031235777X,9780312357771,eng,329,8882,561,10/3/2006,Minotaur Books
26054,The MacGregors: Serena & Caine (The MacGregors  #1 -2),Nora Roberts,4.09,0373285132,9780373285136,eng,441,11070,150,1/28/2006,Mira
36570,The Devil's Waltz,Anne Stuart,3.74,0778322734,9780778322733,eng,363,1275,87,1/24/2006,Mira
30410,A Secret Splendor,Erin St. Claire/Sandra Brown,3.66,1551660954,9781551660950,eng,297,18,2,1/1/1996,Mira (Mills and Boon)
24248,Black Ice (Ice  #1),Anne Stuart,3.71,0778321711,9780778321712,eng,377,8284,628,4/26/2005,Mira Books
30039,The Prize (deWarenne Dynasty  #4),Brenda Joyce,3.98,0778320898,9780778320890,eng,575,1604,66,9/24/2004,Mira Books
30352,Led Astray (Hellraisers  #1),Erin St. Claire/Sandra Brown,3.76,0778321584,9780778321583,eng,240,2647,143,2/22/2005,Mira Books
30354,A Secret Splendor,Erin St. Claire/Sandra Brown,3.66,077832284X,9780778322849,eng,280,1328,32,2/28/2006,Mira Books
30390,Above and Beyond,Erin St. Claire/Sandra Brown,3.73,077832026X,9780778320265,eng,240,2149,87,2/23/2004,Mira Books
16702,Summerland,Michael Chabon,3.55,0786816155,9780786816156,eng,500,619,69,3/1/2004,Miramax
37587,The Criminal Mastermind Collection  Bks 1-3 (Artemis Fowl  #1-3),Eoin Colfer,4.36,0786848693,9780786848690,en-US,912,858,12,9/27/2005,Miramax
1984,Bleak House,Charles Dickens/Mary Gaitskill/Hablot Knight Browne,4.01,0375760059,9780375760051,eng,887,1235,146,7/9/2002,Modern Library
2932,Robinson Crusoe (Robinson Crusoe #1),Daniel Defoe/Virginia Woolf,3.67,0375757325,9780375757327,eng,320,209122,4131,6/12/2001,Modern Library
4472,A Prayer for Owen Meany,John Irving,4.23,0679642595,9780679642596,eng,641,1073,97,6/4/2002,Modern Library
5249,Ethan Frome and Summer,Edith Wharton/Elizabeth Strout,3.86,0375757287,9780375757280,eng,274,483,54,5/8/2001,Modern Library
5337,Little Dorrit,Charles Dickens/Hablot Knight Browne/David Gates,3.99,037575914X,9780375759147,eng,1347,291,33,3/12/2002,Modern Library
5693,Selected Stories of Anton Chekhov,Anton Chekhov/Richard Pevear/Larissa Volokhonsky,4.35,0553381008,9780553381009,eng,467,27027,466,10/31/2000,Modern Library
6112,Siddhartha,Hermann Hesse/Susan Bernofsky/Tom Robbins,4.02,0679643362,9780679643364,eng,129,888,60,7/18/2006,Modern Library
7131,The Count of Monte Cristo,Alexandre Dumas/Lorenzo Carcaterra,4.25,037576030X,9780375760303,eng,1462,9921,586,6/11/2002,Modern Library
7197,The Knight of Maison-Rouge,Alexandre Dumas/Julie Rose/Lorenzo Carcaterra,3.89,0812969634,9780812969634,eng,448,1172,70,9/14/2004,Modern Library
7360,Midnight in the Garden of Good and Evil,John Berendt,3.92,0679643419,9780679643418,eng,388,983,79,9/27/2005,Modern Library
8909,The War of the Worlds,H.G. Wells/Arthur C. Clarke,3.82,0375759239,9780375759239,eng,192,196425,4549,3/12/2002,Modern Library
9820,Crossing to Safety,Wallace Stegner/Terry Tempest Williams/T.H. Watkins,4.16,037575931X,9780375759314,eng,368,31394,4262,4/9/2002,Modern Library
10806,Where the Bluebird Sings to the Lemonade Springs,Wallace Stegner/T.H. Watkins,4.10,0375759328,9780375759321,eng,234,1553,113,4/9/2002,Modern Library
10974,As I Lay Dying,William Faulkner/E.L. Doctorow,3.71,0375504524,9780375504525,eng,231,1003,101,1/25/2001,Modern Library
10982,Selected Short Stories,William Faulkner,4.09,0679424784,9780679424789,eng,320,1017,64,5/18/1993,Modern Library
11376,Main Street,Sinclair Lewis,3.77,0375753141,9780375753145,eng,454,21451,778,11/1/2000,Modern Library
11779,Them (Wonderland Quartet  #3),Joyce Carol Oates/Elaine Showalter,3.71,0345484401,9780345484406,eng,576,2686,230,9/12/2006,Modern Library
11781,Wonderland (Wonderland Quartet  #4),Joyce Carol Oates/Elaine Showalter,3.80,081297655X,9780812976557,eng,528,912,97,9/12/2006,Modern Library
11878,Darkness Visible: A Memoir of Madness,William Styron,4.04,0679643524,9780679643524,eng,96,398,51,1/23/2007,Modern Library
12505,The Idiot,Fyodor Dostoyevsky/Anna Brailovsky/Joseph Frank/Constance Garnett/Alan Myers,4.18,0679642420,9780679642428,eng,667,94133,2760,4/8/2003,Modern Library
12852,The Best Short Stories,Fyodor Dostoyevsky/David Magarshack,4.26,0375756884,9780375756887,eng,320,2711,89,2/13/2001,Modern Library
14680,The Charterhouse of Parma,Stendhal/Richard Howard/Robert Andrew Parker,3.82,0679783180,9780679783183,eng,532,10856,248,9/12/2000,Modern Library
17176,The Sound and the Fury,William Faulkner,3.86,0679600175,9780679600176,eng,368,518,80,9/5/1992,Modern Library
17698,The Cossacks,Leo Tolstoy/Peter Constantine/Cynthia Ozick,3.79,0812975049,9780812975048,eng,161,4356,226,2/14/2006,Modern Library
18243,War and Peace,Leo Tolstoy/Constance Garnett/A.N. Wilson,4.11,0375760644,9780375760648,eng,1388,850,134,7/9/2002,Modern Library
18801,The Captive & The Fugitive (In Search of Lost Time  #5-6),Marcel Proust/C.K. Scott Moncrieff/Terence Kilmartin/D.J. Enright,4.39,0375753117,9780375753114,eng,957,1924,143,2/16/1999,Modern Library
19401,The Decline and Fall of the Roman Empire,Edward Gibbon/Daniel J. Boorstin/Hans-Friedrich Mueller/Giovanni Battista Piranesi,3.98,0345478843,9780345478849,eng,1258,32,8,3/1/2003,Modern Library
20408,The Complete Stories of Robert Louis Stevenson: Strange Case of Dr. Jekyll and Mr. Hyde and Nineteen Other Tales,Robert Louis Stevenson/Barry Menikoff,4.13,0375761357,9780375761355,eng,818,439,12,10/8/2002,Modern Library
25868,Hadji Murad,Leo Tolstoy/Aylmer Maude/Louise Maude/Azar Nafisi,3.84,0812967119,9780812967111,eng,153,176,32,7/8/2003,Modern Library
28715,Blood Meridian  or the Evening Redness in the West,Cormac McCarthy/Harold Bloom,4.17,0679641041,9780679641049,en-US,351,1264,195,1/2/2001,Modern Library
30580,Cancer Ward,Aleksandr Solzhenitsyn/Nicholas Bethell/David Burg,4.21,0679601635,9780679601630,eng,536,79,10,6/13/1995,Modern Library
30598,The Hunchback of Notre-Dame,Victor Hugo/Catherine Liu/Elizabeth McCracken,4.00,034547242X,9780345472427,en-US,534,140,22,11/2/2004,Modern Library
32843,Around the World in Eighty Days,Jules Verne/George M. Towle/Bruce Sterling,3.93,0812968565,9780812968569,eng,211,778,35,12/30/2003,Modern Library
35219,The Red Badge of Courage & The Veteran,Stephen Crane/Shelby Foote,3.38,0679783202,9780679783206,eng,336,497,40,9/12/2000,Modern Library
38264,Moll Flanders,Daniel Defoe/Virginia Woolf,3.52,0375760105,9780375760105,eng,335,387,54,6/11/2002,Modern Library
40604,The Life and Opinions of Tristram Shandy  Gentleman,Laurence Sterne/Robert Folkenflik,3.74,0375761195,9780375761195,eng,704,96,11,9/21/2004,Modern Library
44244,The Beleaguered City: The Vicksburg Campaign,Shelby Foote,4.22,0679601708,9780679601708,eng,368,271,25,1/30/2000,Modern Library
9438,The Basic Works of Aristotle,Aristotle/Richard Peter McKeon/C.D.C. Reeve,4.24,0375757996,9780375757990,eng,1487,2174,51,8/19/2009,Modern Library/Random House (NY)
35261,Frankenstein,Mary Wollstonecraft Shelley,3.79,076660828X,9780766608283,en-GB,189,84,4,7/30/2004,Modern Publishing
8799,Ahora sabr√©is lo que es correr,Dave Eggers/Mar√≠a Victoria Alonso Blanco,3.63,8439710097,9788439710097,spa,400,3,1,3/31/2004,Mondadori
